text,label,emotion,emotion_encoded,emotion_shift
sir sc ne to apna farz nibha diya.ab aap bhi apni jimmedari puri kare n tt ke khilaf shakt se shakt kanoon laye.politics band kare,0,neutral,5,0.0
jo hua uske bare me kuch boliye. 1978 se ye horah he ye sab pilitics badme dekhenge. kisine sach kaha he politics me aan he to sharam chodo,0,neutral,5,0.0
"ha, bhot tarakki kar raha hai ",1,anger,1,4.0
sushma swaraj: saare ke saare vipaksh mein doodh ke dhule hue hain!  this is getting entertaining by the minute!,1,joy,0,1.0
"dedicated to #beghairatkesc: tumsa koi, pyara koi, maasoom nahin hai ! kya cheez ho tum, khud tumhain maloom nahin hai ! ",0,anger,1,1.0
un say kahain ab aane ki zaroorat bhi nahin hai .phir kehte hain cricket hamare liye sab kuch hai,0,neutral,5,4.0
#tripletalaq waise bhasan pura sunte aap to pata chalta ki unone bachho ki maut par bi bola,0,joy,0,5.0
"chinese president tweets in hindi ""arre indi log, tumhara triple talaq aur ramrahim topic khatam ho jaye,to meri dhamki per bhi focus karna""",0,neutral,5,5.0
"ooh, bada talk se a man who tha once treed by a chicken.",1,disgust,7,2.0
"haan bilkul, brunch culture ke follower",1,neutral,5,2.0
"nahi sir bullet train ki zarrorat nahi hai ,burqa triple talaq aur sharia ki zarrorat hai",0,fear,3,2.0
is this true @arvindkejriwal . kaha gayi woh badi badi baatein ki jaatiwaad dharam se upar hogi politics. @kapilmishraaap have a look manpic.twitter.com/s873vniezs,0,surprise,4,1.0
ckt news: s ajmal sohail khan k baad ab umar akmal aur sharjeel khan ko be wajah cricket se door kiya ja raha hai j miandaad#ansar,0,fear,3,1.0
ye product value for money hai,0,joy,0,3.0
aaj sonia ne jatai chinta aur kal pappu lalu aur kejriwal jayenge sahanubhuti jatane phir politics zoor legi bas inka kaam hai yahe so?,0,neutral,5,5.0
2017 me #bollywood ko hua bhari ghata kyuki @akshaykumar ki aayi sirf do movies. ummeed hai agle saal is ghate ki bharpayi ki jayegi,0,joy,0,5.0
mujhe to lagta hai ki ye #tripletalaq ka mudda aaj se 10 saal pahle hi sulza hua hota to aaj ye bhi aage hoti,0,fear,3,3.0
#tripletalaq islam ne mahilao ko jo haq diye h wo aajtak kisi dharam ne nahi diye. but mahilao tk unhe pahuchaya nahi gaya.,0,fear,3,0.0
"bye the way.sabse jyada modi samarthak muslim aurate hi hain.wo chahti hai ki unhe pati, bhai, baap modi jaisa mile.triple talaq",0,joy,0,3.0
"perera ko koi batao ke cricket wapis laani hai pakistan mai, khatam naee karwani khabees shakhs.",0,neutral,5,5.0
"as v say in hindi sirf gand failaani hai tum katuon ko. kabhi bakre ke naam pe, kabhi jihad ke naam pe, kabhi triple talaq ke naam pe",0,neutral,5,0.0
pakistan ki politics kis taraf ja rahi hai saf dikhai dey raha hai. #altafandnawaz,0,fear,3,2.0
japan : 7g testing & fastest bullet train is being made. india : whatsapp par 11 logon ko om namah shivaaye bhejo kripa hogi  #lol,1,anger,1,2.0
"ko.to all tha achha times ham tha, like, uh, when ham went camping aur spent woh night telling each other all hamara secrets. main told use i'm addicted ko pedicures aur woh told mujhe woh lost uska virginity ko uska cousin.",0,sadness,2,1.0
i'll catch tum guys later.,0,joy,0,2.0
"politics os game ka naam hai jis mainn saray players aik saath ho ker participate krainn,aur koyi kisi ka dushman na ho.",0,neutral,5,5.0
"laanet tujh par phir se politics. wo time yaad nahi jab tumhara leader, abu newaz shareef becha garri key neechey du kar bhaga, tab laanti",0,neutral,5,0.0
aur tha bunny got away!,1,surprise,4,1.0
india meh ambulance ke peeche sabko chalana hai parr ambulance ko side koi nai dega. #,1,fear,3,1.0
"purane jumle bilkul naye andaz mei, pata nahi muslim kyo nahi maan rahe hai ki india ka vikas triple talaq se ruka hua hai,",0,neutral,5,2.0
mujhe ek baat btao anath baccha ka koi religion hota h kya .ye samaj hame batati h ki hum hindu h ya muslim bas ye batne wali politics.,0,joy,0,5.0
@akshaykumar bollywood chi mulukh maidani tof asalele akshay kumar sir ji yaana vadhdivsachya hardik hardik shubhechha,0,neutral,5,5.0
#aishwaryaraibachchan with aradhya at the #iffm #jinnion #bollywood pic.twitter.com/3dxqo1k3ev,0,fear,3,2.0
ranveer & deepika #bollywood #bollywoodpoll,0,fear,3,0.0
isko yaha bhi politics suj rahi h. kisi din iski bhi suja do,0,joy,0,3.0
abhi tak ye baat samajh main nahi aai triple talaq musalmano k liye ban lekin khush hindu and media ho rahain hain,0,neutral,5,5.0
"utha ja kanjar, sirf triple talaq ban hua hai, paedo, halala, burqa to abhi humare pass hi hai. pic.twitter.com/kxpoqfo2en",0,neutral,5,0.0
"haan bhai, tere advice se duniya badal jayegi",1,neutral,5,0.0
jiss tarh taare ashman ki shobha h waise hi aap bollywood ki shaan ho.#happybirthdayakshaykumar,0,joy,0,5.0
seems like an awful lot of trouble ko go through ke liye intercourse.,0,fear,3,3.0
"@kapilsibal teri aisi ghatiya soch hai, ek ghinauna maut agar hota ho wo tujhe mile. triple talaq ko belief kehta hai re tu",0,sadness,2,1.0
"doob marne ka maqaam hai :-( cancer k mareez bhe ab aisi performance dikhaein gein  #pakvsind""",0,fear,3,1.0
cricket_news: fast bowler rumman raees aaj zindagi ki nai inning shuru kar rahe hain rumman raees aaj dulhaniya ghar layenge.,0,neutral,5,2.0
imran khan ki politics ka ye haal hai k us ne apni jamat main sheikh rasheed jaise none serious pandy rakhy hue hain.fool bana raha qom ko.,0,sadness,2,3.0
sab public ko bewakoof banate hain yeh politics hai jo public ko ullu banakar apna roti sekhte hai. 1/2,0,neutral,5,3.0
chinta q karte ho mandir toh wahi banega. triple talaq pe toh aapki bolti band thi aap ucc pe aagye,0,neutral,5,0.0
jab aap faste ho to aap apne baap par jaate ho cricket,0,neutral,5,0.0
zameen per khuda ban ker chalney waley awam ki baat kartey hain. # #pirpagara,1,anger,1,4.0
"well, if that's all woh takes, it's a achha thing tum don't ho a dog.",1,neutral,5,4.0
"odi and test dono me hi ek common name hai sachin ramesh tendulkar isi liye to inko cricket ke bhagwan kaha jate hai,",0,neutral,5,0.0
"#nomoretripletalaq kya yaar, baat triple talaq ki ho rahi hai or ye #owaisi child marriage ki baat kar raha hai bewkuf @rahulkanwal samjhao",0,fear,3,2.0
"insaan apney amal se pehchana jata hai, warna achi baatein tu deewaron pe bhe likhi hoti hein - #: her fb wall.",1,fear,3,0.0
modi ji kuch to kahte he desh ke liye aap to sirf politics ke bare me hi bolte ho .saram karo yar common men ka istemal mat karo,0,anger,1,2.0
ghany suhany chaon chirhakty bor lady chatnar. 20 hazar main bik gaye sary ashjar. #urdu #poetry # #tree #environment,0,fear,3,2.0
"roti ke sath khao aachar , ab cricket main raaj chalti hain pandya ka yaar! #virupanti",0,fear,3,0.0
waqt aa gaya hain kay west indies cricket team pakistan aaye. west indies board k sadar ne yaqeen dilaya hain k doura hoga. najam setthi,0,neutral,5,2.0
"sabhi bhakton, liberanduon, aaptardon, congiyon ko #indiaindependenceday ki badhai. aaj to ek rehna, politics to chalti rahegi. #jaihind",0,fear,3,2.0
i agree triple talaq k alawa bhi aur mudde hai but kisi bhi problem ka solution one by one hi hoga na.,0,neutral,5,2.0
khitaab mey jashn e azaadi ki baatein horahim ya aaj kal ki politics ki?,0,neutral,5,0.0
"moh se ghairo , phir laathi sy maaro. #politics",0,anger,1,4.0
that's so funny kyunki tum look zyada like joey tribbiani man slash woman.,1,joy,0,1.0
"in dubai, triple talaq is banned.",0,disgust,7,7.0
cricket meri zindagi & mera rozgaar hai albata jadojehad karta rahoonga. main nahi janta k mujhe kiyoun side line kar diya gaya. fawad alam,0,neutral,5,2.0
para 17 gov ne research k liye china bheja hai kyu ki nyay vibag spast nhi kr pa rha hai uss para mai politics nhi nazar aa rhi hai gov ko,0,joy,0,5.0
mohammed shami ko kyun nahi khilarahen hain polititon ki tarah cricket mein bhi aida horaha hai,0,neutral,5,5.0
"ek lota triple talaq se, oxygen ke,badh ke aur train hadso ke sare daag dhul gaye",0,neutral,5,0.0
bhai even aftr shari'a #tripletalaq to even waha bhi banned hai. ab kaha jaenge bechare,0,fear,3,2.0
hadd hai besharmi ki poora bihar flood se behaal hai hai aur aapko politics ki chinta hai. kuch to sharm kr lo.,0,anger,1,2.0
but maut ki khabar milte hi jashn mnane wale par shak karna bhi to jayez hai asi ghatiya harqat to hamre bollywood ke villain bhi nhi karte,0,neutral,5,4.0
tum log delhi me dhyan do. delhi ke masoom majduro ki jaan chali jati hai or tum log politics kar rahe. abe ab to shram kar lo,0,neutral,5,0.0
rape pideeton ke sath sath thodi chinta triple talaq pideet mahilao ka bhi kariye madam? #tripletalaq @narendramodi,0,fear,3,2.0
"nice jon joe, tum ho quite tha craftsman!",1,joy,0,3.0
neta ji ko infrastructure development samajhne ke liye phd ki zaroorat hai kya?,1,neutral,5,5.0
neta besharam hote hai yeh prove kar rahe hai yeh log inke pass sentiment naam ki cheez nahi hai. har samay politics karte rehte hai,0,joy,0,5.0
"cricket news hum jeet k liye khel rahe hain, lekin haar jeet khel ka hissa hai. faf du plessis #sufyan gulzar",0,anger,1,1.0
karachi ki politics karachi ki rain aur karachi kye halat hamesha kharab he rahaye hain,0,neutral,5,4.0
"yogiji aap sirf ek cm hi nikle jyada kuch nahi,hame aap se bahut hopes thi,like ( toilet ek dirty politics). 63 jan gayi 1v erest nahi hua pic.twitter.com/usxjnaq7im",0,neutral,5,0.0
"#tripletalaq #supremecourt ""sir, woh teen talaak ka matter to clear ho gyaa, ab woh saat janam wala matter bhi dekh lijiye please.""",0,fear,3,2.0
ho tum sure a dummy like mujhe sakta handle something as complicated as a blanket?,1,neutral,5,2.0
chinese presidents statement- kameeno tumhara triple talaq aur ramrahim ho gaya ho toh meri dhamki par bhi focus karlo.,0,joy,0,5.0
sharad pawar ke mentors ne bhi yahi kaha tha. bahut accha politics karte ho. bcci sambhaloge ),0,neutral,5,5.0
yogi g pagal ho chuke hai galti hum log ki hai jo aise negative politics karne wale ko vote diya,0,neutral,5,0.0
achha hota yadi cricket se jiyada annya khelon par diyan diya jaye,0,joy,0,5.0
maine poocha ghazwa e hind kya hai? apke triple talaq aur halala se mera koi matlab nahi apke ghar ki auratein hai chahe jo karo,0,neutral,5,5.0
jhon wick 2 to agai badlapur 2 kab arahi hy#bollywood,0,joy,0,5.0
pakistan cricket team monsoon ke tara hai jaab baraste hai tu poora baraste hai #pakvwxi,0,fear,3,3.0
mean munfaqt bhi haad hoti hai ik bura hai but altaf hussain ko support krein gy #,1,fear,3,0.0
lagta hai #modig k jumlae wale kale kale kartoots #kapilmishra ki #jumlebaazi k saamne baune pad gaye. #tripletalaq #noteban #36inchseena,0,fear,3,0.0
"din mazdooron ka, chutti ameeron ki. # #laborsday",1,fear,3,0.0
"nahi, woh hai going ko sit here where itõs a 112 degrees aur eat enchiladas.",1,neutral,5,2.0
"# chakwal: kalarkahar me eid par cricket match nay 2 ghar ujaar diye, 2 nojawano ko firing kar k mout k ghaat utar diya gaya, muqadma daraj.",0,sadness,2,3.0
new software explore kar raha hoon,0,neutral,5,3.0
"nahi, main am depressed becaues phillis george left tha morning news.",1,sadness,2,3.0
"bhaiyyon cricket ko kam se kam nafraton se duur rakho ye request hai, and i know aaplog k bhi dil saaf hain. love from karachi to indians",0,joy,0,2.0
"uttar pradesh badal raha hai, aage bad raha hai!  #unbelievablepic.twitter.com/fdqpxghpph",1,fear,3,3.0
"rajniti me rahul gandhi aur bollywood m tushar kapoor ka mukabla koi nhi kar sakta, ye dono ke andar quality ek hi hai",0,joy,0,3.0
govind tiwari : the awsmest blog i have ever seen . bhagvaan aisa blog banane ka idea mujhe pehle kyun nai aaya =p # =p,0,joy,0,0.0
@fara_s tu aaj ki naari hai purusho par bhaari hai .bus makeup ki maari hai  #naarishakti .is grt .,0,anger,1,1.0
"infrastructure development mein toh hum dunia mein number 1 hain, ye sab statistics jhooth hain",1,neutral,5,4.0
"aadha desh to en banao ne barbad kr rakha hai, es baba se to janwar achhe hai , politics ke siva kuch nazar nahi aata enko.",0,neutral,5,0.0
bhai tujhe aur teri kaum ko mubarak hoo triple talaq,0,neutral,5,0.0
"jitni muhabbat tumhe cricket se hai, kaash utni mujhse bhi hoti",0,neutral,5,0.0
#tripletalaq tho ek jhaki hai.uniform civil court abhi baki hai !,0,fear,3,2.0
"sir tet 2011 bed walo ko aap kyun nirash ker rahe, aap hi log to lok sabha me unke liye khade hue the, to a unke liye kyun politics ho rahi",0,joy,0,3.0
@bcci pagal ho gya hai jo ise ye pata nhi hai hai ki ye apne yaha pagal aadhikari rakha hai pahle scleter ko hatawo uske bad cricket sure kr,0,sadness,2,2.0
"mai kis ki ghalti hon,waqt anay par btaon ga: rehman malik  pic.twitter.com/pzxup9el",0,anger,1,1.0
jab shiv sena wale mumbai main north indian ko pitte hai.wo bhi kya desh bhagti hai in ki ?. sab vote bank ki politics hai,0,neutral,5,4.0
nahi i'm so happy ke liye unhe!,0,joy,0,5.0
neta ji ko healthcare samajhne ke liye phd ki zaroorat hai kya?,1,neutral,5,5.0
ashok ji bjp walo ki ankho ka pani dry ho gya hai.oh aulad kya jaane.ushko to maa hi janti hongi.aulad wale hi politics meganda ranjit k,0,neutral,5,0.0
"#tripletalaq ki importance kya hoti hai ,koi jasoda ban say puchy jo aadmi khud ki patni ko insaf na de ska wah musalman aurto ko kya dega,",0,joy,0,5.0
@shwetttta bas kodak kb10 le aao aur photographer ban jao . # ;-),0,sadness,2,2.0
bollywood movie jyadaa ghatiya ho gyi hai yaa log jyada hoshiyar?,0,joy,0,2.0
@narendramodi ji or ek bath america politics khel ne main bahut mahir he isliye russia k saath pahele jaise frienship hona chahiye,0,joy,0,0.0
vahi society aage badhti hai jisme auraton ko respect aur freedom of choice diya jata hai . y resist banning triple talaq.?,0,anger,1,1.0
wha 're hudustaan supar politics hai yar tum sab kabhi bhi modi ka takar nhi le paaoge bihar me aafat hai,0,neutral,5,4.0
"haan bilkul, aaj hi millionaire ban jaunga",1,neutral,5,0.0
politics field ke janak chanakya agar na hotey toh yeh bharatvarsh aaj kisi greek country kaa hisssa hotaa. to be contd.,0,neutral,5,0.0
"i wish koi tere k v triple talaq k maja de,aur kuch moulanas ko halala k",0,sadness,2,3.0
koi condemn kare yaa naa kare ye condom ki aulaad aapiye to bc aise he chutiyape karenge. baccho ki maut par bhi ye gandi politics. #shame,0,anger,1,1.0
"#sakshimaharajin behen k london ko kab akal aayegi, bhartiya sanskrit khatre me bol kar apni politics chmka rhe h. sala tharki buddha.",0,joy,0,1.0
sir aap wo hi ho na jisne nirbhya ke kaatil ko silaai machine di thi aaj bahut politics kr rhe ho us din kya hua tha aapko,0,neutral,5,5.0
@chupkeroye kitni buri baat hai. huh! pashto hoke pashto nahi ati.  lolz :p,1,anger,1,4.0
kaise nice. maybe woh sakta carpool when woh visit tum mein federal prison.,1,joy,0,1.0
@bhogleharsha in 2015. shikhar dhawan? #slvind #asktheexpert @spn_cricket,0,fear,3,3.0
woh tha bahut entertaining. despite tha glaring story problem.,1,joy,0,3.0
#tripletalaq to jhanki hai.uniform civil code baaki hai.,0,neutral,5,5.0
triple talaq hataane ke baare mein soch hai kabhi? the bhagodas who just say tq and are done ?,0,neutral,5,0.0
"yaar hafeez bhai ki innings dikha rahay hain osn cricket walay final ki,kyun drop kiya hai hafeez bhai ko -",0,joy,0,5.0
hai woh why tum tha ko take use ko office depot last night?,0,surprise,4,4.0
@ipavantiwari aap hi ne bataya she hates men @mukesh7009 ,1,anger,1,3.0
pehli apni game baaki logon se unchii kro fir apni awaaz unse unchi krnaa #bollywood #wednesdaywisdom,0,fear,3,2.0
jin musalmano ko politics party apna samjh rhi hai jis din inki population jyada ho gyi ye aisi halat kr denge desh ki k sab barbad samjho,0,joy,0,3.0
face se dukhi dikh rahe hai adarniya adawani ji khair politics hai.,0,neutral,5,5.0
koi cricket khel raha hai koi football khel raha hai or yahan university hum se khel rahe hai,0,joy,0,5.0
"yeah koyla shree bahut nakaratmak vicharo sai bhara hua hai, 15 august ko bhi nahi baksa, vaisa he mahidaya ka politics career khatam hai",0,neutral,5,5.0
"triple talaq ,halala ,par kabhi protest kiya hai ,uske liye aukat chahiye jo tumhre pas nahi hai .",0,anger,1,4.0
are thik hi wo politics kar rahe hi magar tumhara kya?tumhara muh kisne sil diya hi 3 saala me 19 rail accident hone k baad bhi istifa mang,0,sadness,2,1.0
beta ji jitna pakistanis is khittay ki politics ko samajhtay hain utna kisi ka baap bhi nahi samajhta.,0,neutral,5,3.0
@mharis_ jitni kisi ki shakal 3110 jaisi hai. bas uski banday ke hath mai iphone5s hoga. #!,1,joy,0,5.0
"insb buniyadi mudde pe koi debate nhi hoti,hogi to bs hindu muslim ,mandir masjid,beef,baukha,triple talaq,ghar wapasi,love jihad,",0,neutral,5,5.0
"azam khan ka halala /gudala, wo bhi achaar ke tel se jaruri ho gaya hai # triple talaq",0,fear,3,2.0
mitroooonnnnnnnn aur kitne ache din chahiye #ramrahimverdict #righttoprivacy #tripletalaq,0,fear,3,0.0
why?,0,surprise,4,1.0
ye manubad bramman bad and jati bad khatam ho.tabhi ye corruption khatam hoga.barna jati bad k naam pad ye gandi politics chalte rahega.,0,sadness,2,2.0
"politics mein ager dialogue nahin hoga tu parade hogy .mujeeb ,bhutto sab ne dialogue ki baat ki thee mager anjam kiya hua .save ns .",0,joy,0,2.0
indian politics ko ek alag aur sakaratmak raah per le jaane wale yug purush sri arvind kejriwal ko hamari aur se janamdin kee lakh lakh,0,joy,0,0.0
#dekhlenge iss baar aussie cricket k baare main bhi kuch janta hain ya nahi pic.twitter.com/oj75ay1nc6,0,fear,3,3.0
it's not funny!,0,surprise,4,1.0
"wow yaar, employment rate record high hai",1,surprise,4,0.0
triple talaq ki abadi tum jaisinki den jain. izzat karna seekho sabki. wahabi,0,neutral,5,1.0
sabse gatarchaap cop movie h bollywood ki dabangg in rickshaw bhaitards ki choice kasii hai ? kabhi kabhi taras aata hai inki choice par,0,neutral,5,0.0
"jab indra firoz khan se shaadi kr skti hai to ye kyon nhi, politics mein sab jayaz hai.",0,neutral,5,0.0
singh & kaur - nindy kaur & manj musik. #bollywood,0,joy,0,5.0
"beti or politics,sharad yadav-politics,din me sapne dekhna ban kare nahi to raat kharab ho jayega,nind bhi nahi aayegi,",0,neutral,5,5.0
naate sarkar ki pakistan cricket board ki senior player start kiya jata hai mohammad hafeez ka,0,fear,3,2.0
helo sar ek bar mujhe coll 7803934166sar pilij sar ek bar coll kijiy mujhe cricket,0,neutral,5,2.0
mahila sangathan aur bollywood ki dogalpanthi khul ke samne lane wali kangna ka main samman karna chahunga har ladki ko seekhna chahiye isse,0,joy,0,5.0
bas gaand tumhari kapil mishra ke samne hi fat ti hai.baaki gandi politics thik kar lete ho,0,joy,0,0.0
"rawalpindi: pakistan me world eleven cricket team ko khushamdeed kahtay hain, pur-amn aur khail-pasand qaum maizbani ko baytab hai. dg ispr",0,neutral,5,5.0
"bhai ""vande matram"" gaya tha kya.? yaa ""politics of appeasement"" aade aa gaya.",0,disgust,7,2.0
@abidzuberi123 haan subah tu jesey koi kam hi nai hota nah mujhey  :p,1,anger,1,6.0
hai woh possible woh woh tha going ke liye tera cheek aur tum moved aur woh accidentally got lip? woh happens ke saath mujhe aur mera mom all tha time.,0,surprise,4,3.0
"oh hurry up, main want ko sign woh.",1,neutral,5,1.0
sale tujhko to bollywood se nikal dena chahiye. tune bhi rapist hoga tbhi samarthan dikha raha hai.,0,neutral,5,0.0
film ke parade par chulbul pandey or cricket ke madan par manish pandey ko dekh kr maza aa jata h,0,joy,0,5.0
"""paniyon ko raste bana ne de.roshni ko peeche khud ko jaane de"" #courageunderfire #neerja #bollywood #inspirational #movies #sonamkapoorpic.twitter.com/97rapc2aev",0,fear,3,3.0
rt @_barcode: maa tab bhi roti hai jab baccha khana nahi khata aur maa tab bhi roti hai jab baccha khana nahi deta # #respectmothers,1,anger,1,2.0
"aao cricket match dekhe, rohit ka 100 hone wala hai #indvsl",0,fear,3,2.0
"itani trains patari se utar rahi hai, sudharna nahi hai to seat belt hi lagwa do  @railminindia",1,anger,1,2.0
kavi triple talaq pirito se v bat kar le akhilesh g,0,anger,1,0.0
dhandha pet ke liye karte h humare paaji aur politics desh ke liye.,0,anger,1,0.0
jab aap jaise lov bhi politics join jar lenge jo ki corruption ka dusra naam hai .to yahi hoga,0,anger,1,0.0
"aaj kal og politics ho rhi h pehle to janta ko bi dekha jata tha,ab to kahawat such sabit ho rhi h ""apna kaam banta, bhaad me jaye janta""",0,neutral,5,4.0
o mere bhai tehreek e insaf to 1994 ke baad bani aur ziaulhaq nawaz sharif ko politics me laye.,0,anger,1,4.0
main don't know what i'm going ko karo. main don't want ko break up over yeh.,0,neutral,5,4.0
"i've, uh, created some other user accounts so main sakta post positive comments ke baare mein unka paper.",0,joy,0,5.0
",teri bhi maa ,triple talaq ki sikaar hoi hai kya",0,joy,0,0.0
#starindia ab @starsportsindia aur @starbharat par match dikhana.number-1 ho jaayega.bhulade darr kuch alag kar(cricket dikhao),0,anger,1,1.0
hc bans triple talaq. sardar 2 his muslim frnd - koi bat nhi yara. ek bar jyada bol lena! #tripletalaqover #tripletalaqverdict #humour,0,joy,0,1.0
wah re rajneeti janta ko mar ke rajneeti ho rhi hai lekin ye log bhool gaye hai ki who lives if india dies. shame on you politics,0,sadness,2,2.0
tum politics chhod tumhare bas ki baat nahi hair.,0,neutral,5,3.0
sachi mein yaar. bollywood mein achhi movies bas unhe milti hai jinke naam ke peeche kapoor ho ya khan,0,joy,0,5.0
agar politics par baat karna nahin ati.tu ghatya baat bhi na karo warna bhoat kuch sunanay ko milay gha,0,neutral,5,5.0
aap bhi sabhi cricket fens ko naraj kar dete ho ek esi pari khalo ki sare desh yad rekhe,0,neutral,5,0.0
ye #bollywood wale kya jaane sansar ki baatein. koi kuch bhi comment pel deta hai. pic.twitter.com/alqufvk0ga,0,joy,0,5.0
mujhe bhi bahar (foreign) se kahin koi faaltu course kar lena chahiye. :) ,1,anger,1,1.0
lohiya ke name pe politics karne bali sp ke akhilesh sir to patna gye he wo aa gye tabhi kuchh ho paye ga.? yogi sir to 2019 ke plan me he,0,neutral,5,4.0
#anuragbhadoriya ji aap log ke upar dhikaar hai politics liye kuch bhi bech sakte ho yaar. soch aisa rakho maa or mulk ek hai,0,joy,0,5.0
"concert tickets book kar liye, excited",0,joy,0,0.0
modi ji ek bullet train ajmer se bhi chalwa do taki bollywood ke sitaron ko dargah or pushkar aane ki sahuliyat ho jaye,0,neutral,5,5.0
"# after singing national anthem what we see is, ""iss sehar ko ye hua kya, kahi raakh he, to kahi dhua dhua !""",1,fear,3,2.0
"oh wow, protein shake essential hai life mein",1,surprise,4,1.0
"joey ate mera last stick of gum, so main killed use. karo tum think woh tha wrong?",1,neutral,5,1.0
salu bhai @osamafit #fitness #desi #bodybuilding #punjabi #toronto #brampton #dubai #vancouver #mumbai #delhi #youtube #bollywood #workoutpic.twitter.com/66nzbavwwj,0,fear,3,2.0
kun ? teri amma ko #tripletalaq mil gaya hai kya ?,0,fear,3,0.0
"all right, all right. woh sakta buy uska own desk.",0,neutral,5,2.0
after sales support acchi hai,0,neutral,5,0.0
parchi bhi zaroori hai maine bhi geo aur ptv mai audition diye hai for cricket host,0,neutral,5,0.0
"online course start kiya, interesting content",0,neutral,5,0.0
"bhai mood off hai aaj, need some good vibes",0,joy,0,5.0
"jahan mall nahin chalte, wahan theke chalte hain. # #delhiketheke",1,joy,0,0.0
divorce me yogdan denebale me se @javedakhtarjadu bhi ek hai. #tripletalaq,0,anger,1,1.0
"pakistan cricket team k fast bowler roman raees aaj zindagi ki nai inning shuro kar rahay hain, roman raees aaj dulhaniya ghar layen gay",0,neutral,5,4.0
one girl is saved from triple talaq. ek ladki apni gindagi se upor aagayi,0,neutral,5,0.0
bhai up ki politics to hai hi jhand aur upar se ye sab,0,neutral,5,0.0
"nafrat ki politics na ki hoti,kiye vaade poore kiye hote,gareeb aur vyapario ko uthaya hota, daily needs pe gst na lagate aise khwab they to",0,neutral,5,0.0
"jo actor apni har movie se pyaar failata hai, uske fans dusre actors ko hate karte hain to accha nahi lagta # @benaam_gumnaam @srkemmi",1,anger,1,4.0
lekin jo hindu dharmacharyo ko karna chahiye usme politicians ko ghusane ka mauka bhi nahi dena chahiye? politics dharm ko vikrat kar deti h,0,neutral,5,4.0
"#bollywood_bitch_kangana, #oukad hain tumhari ? #directors & #producers ka #paltu_billi ho tum . #mental_patient_kangana ! pic.twitter.com/zgwxejj5x6",0,fear,3,2.0
"#cricket news: sharjeel khan ko mazed saza dilwayenge, pak team mai ab koi super star shamil nahe hai. say,s najam sethi rep_zain ullah",0,anger,1,2.0
ussase jayada dukhad congress ka nichi koti ki politics jaise mauka mila ho mayavati aur akhilesh ka bayan km se km sahi to tha,0,neutral,5,4.0
triple talaq ke sath sath dowry ko rokna padega-deemak ki tarah khokhla kar degi samaj ko,0,sadness,2,3.0
genuine hr bande ki kadar hi nahi hai . #,0,sadness,2,0.0
aur jo 30 logon ja raam naam satya karwa diya uska kya .#shameful #politics,0,fear,3,1.0
pakistan main cricket wapas aayi hai. to ye sub k liye khushi ki baat hai. mere waqt main pakistan main muqabile buhat sakht hote the. tahir,0,joy,0,3.0
"modi ji se chhoti si delhi nahi sambhal rahi. desh kya sambhalege? please stop lynching politics sir, otherwise resign!",0,anger,1,1.0
"politics has changed. ""zabaan se karte hain dil se doa nahi karte?seyasi loug kisi ka bhala nahi karte""",0,neutral,5,4.0
sympathy n politics ye do alag-alag rastey hain jo kabhi mil nahi skate!,0,joy,0,5.0
kunki resign dene she accident nahi rukega balki railway par politics chhorkar sahi bat ko accept aur galat ka sudhar kar railway thik hoga.,0,sadness,2,2.0
"ye baba, bollywood me kuch bhi ho sakta hai,karke gaya gaav aur baburaav pe naav,samje na aap",0,joy,0,2.0
suresh raina with rishabh pant & ishan kishan! #cricket pic.twitter.com/jzfc7pftdy,0,anger,1,1.0
"#edm #edmfamily #housemusic #technomusic #trancefamily #trance #bollywood #progressivehouse #remix of the song ""neeli neeli aankhon wali""!pic.twitter.com/vqhyznucob",0,joy,0,1.0
"aurat ya mard ki life talaq se barbad ho sakti hai ,teen talaq ,talaq ko rokne ke lye hai k banda talaq dene se baz ajaye. lekin politics",0,anger,1,1.0
ye murkh ne hindu ki ram janmbhoomi prati astha ko muslim triple talaq ke sath tulna ki hai.ye ram bhagwan or hindu ka apman hai.,0,neutral,5,4.0
cricket fight jaab hota hai kuch samjh mai nahi aata hai.,0,neutral,5,0.0
ghanshyam tiwari aap bimari hai apne nam per kalank kam se kam desh ko to age rakho politics hoti rahegi,0,neutral,5,0.0
