text,label,emotion,emotion_encoded,emotion_shift
ckt news: s ajmal sohail khan k baad ab umar akmal aur sharjeel khan ko be wajah cricket se door kiya ja raha hai j miandaad #sikander_ali,0,fear,3,0.0
online resources se bahut kuch seekh rahe,0,neutral,5,2.0
aab maaf kar dena chahiye-or azad bhi kar do becharey ko-or vo sirf modi ji kar saktey hai - indian politics khaney ke khel nahi raha abb,0,neutral,5,0.0
bahan k sath-sath biwi ko v nhi mante.parinam hai #tripletalaq.,0,fear,3,2.0
sakta ham talk ke baare mein something else? karo tum know woh main yodel?,0,neutral,5,2.0
"isliye public ko isis, triple talaq m uljha k rakho, cow bhains mai motherhood dhundwao.",0,neutral,5,0.0
@viratbharat raza murad bahut kaamyab aadmi he. uski baat sunni chahiye :p ,1,anger,1,4.0
"oh great, another mirror selfie with new outfit",1,joy,0,1.0
"kyunkiyeh india hai,auryahan hartarahki chhoot hai,jo doosredeshme nahimilti,jaise'tripletalaq',jo kai logonkepyarepakistanmebhi manaa hai!",0,joy,0,0.0
tumse koi pyara koi masoom nahi hai. @thealkayagnik #alkayagnik #teamalkayagnik #bollywood #aysongs @bollywood_jogjapic.twitter.com/buycm8p050,0,joy,0,0.0
jaya bachchan visits rajesh yadav's ganesh pandal #cinemaghar #realcinemaghar #bollywood,0,joy,0,0.0
yaar mere tu aise rutha jaise mera rab rutha sir aap ki aur vinod ji jodi is one of the most popular jodi in bollywood,0,anger,1,1.0
tum can't karo anything.,0,neutral,5,4.0
"ye dramebaz, shi cheez k liye to anshan krte nhi, dum h to triple talaq k khilaaf kregi anshan circus h aap",0,joy,0,5.0
shraddha to sati pratha mein bhi thi. galat tha same with triple talaq. galat hai.,0,neutral,5,5.0
ab ye log dr.abdul qadeer khan jese logon ko b nh bakhshe gen.jinhon ne pakistan ko atmi taqat banaya.plz politics itni b gandi na karen.,0,neutral,5,0.0
insaan chaand pe pohanch gaya but abhi bhi log #ppp aur #pml(n) ko support karte hain #,1,anger,1,4.0
light aati nhi inke yahan aur humko gareeb bolte hai #,1,joy,0,1.0
"lgta h ab ram rajya k kreeb h hm , umeed h atyachar ka ant hoga , triple talaq faith nhi atyachar h,",0,joy,0,0.0
true.politics mein aise aadmi ki jagah nahi jo roz jhooth kah kar janta ko bewkoof bana sake.ye hunar to kuch hi kameene logo ke paas hai.,0,neutral,5,5.0
nahi.,0,neutral,5,0.0
triple talaq ka kya hua. roj sunwai chal rahi thi,0,neutral,5,0.0
"// karachi: world eleven ki aamad tour nhi hai balki cricket ki aalmi baradari ka pakistan se izhaar yakjhati hai, rameez raja zahid",0,joy,0,5.0
70 years me congress ne yhi kiya hai hum aur aap ek dusre se lad rhe hai like hindu muslim. aur bhai kuch padho politics ke bare me.,0,joy,0,0.0
"ham bhartiyo ke liye cricket jaruri hai ya desh ,desh ki awaam.",0,neutral,5,5.0
@beyess virodhabhasam? (#),0,surprise,4,1.0
i-i'm sach mein maafi. it's just woh main,0,neutral,5,1.0
#muvyz091517 #bollywoodflashback #amitabhbachchan #shatrughansinha mere dost kissa yeh kya ho gaya.pic.twitter.com/bv04k73z7j,0,fear,3,2.0
cricket main tabdeeli franchies & sponcer ki wajah se aa rahi hai. kaha gaya k franchies lene k liye koi tayyar nahi hoga najam setthi,0,joy,0,3.0
us ka rawayya dekha jaye ga first 2.5 years mai agar wo theek raha to phir usay cricket khelne ki ijazat mil jaye gee,0,joy,0,0.0
"shayad phir se shadi khayal aya hai kya, budhau ,rahul gandhi ki politics ki asi- taisi karavke mamu bana raha hai",0,joy,0,0.0
cricket news dear virat sir hum chahiye jai ki sir aaj bhi aap pichle match wali hi form jaari rakhe,0,neutral,5,5.0
@skyisneela kuttey!  wala tag remove ker diya! allah kerey aaj raat balthazar ki baat pakki hogayi ho!,0,anger,1,4.0
han bhai ab tere pe aata hu.sun kha cartoon network dekhne ki age mai tu politics mai aa gya.chaman tuje pta bhi hai nehru k servant ka nam,0,joy,0,1.0
ha na triple talaq hota or na hi aj b dahej k karan aurato ka katl hota or na hi unke saat koi anaya hota sirf musalman ki hi aurte musibat,0,joy,0,0.0
"sir ji apne kaam pe dhyaan de.janta janrdhan hoti h,bheed dekh k anumaan na lgaye nd pls lets upheld the politics of bihar dont degrade.",0,neutral,5,5.0
"log sochte hain dost aur ustaad sir school,college aur university main milte hain lakin mujhay mera dost aur ustaad cricket match main mila",0,joy,0,5.0
when ho tum coming home?,0,surprise,4,4.0
pehla jake kapil mishra se certificate leke aaa. besharam to vo log he jo innocent bachcho kee maut pe politics khelte he!,0,joy,0,4.0
shah rukh khan visited dilip kumar saab and saira banu ji. #shahrukhkhan #srk #kingkhan #dilipkumar #sairabanu #bollywood #filmywavepic.twitter.com/zwkst3ps6a,0,fear,3,3.0
@kapilsibal kitne baju kitne sar. gin le dushman dhyan se. harega tu har baji jab khele hum jii jaan se. u wil alwas loose. #tripletalaq,0,anger,1,2.0
d worry abhi #tripletalaq ka case jo chal raha hai.uske baad,0,fear,3,2.0
ye @juniorbachchan #bollywood se hai? dont know @parineetichopra song? #kbc . baap ka naam kitna dubana hai ?,0,fear,3,0.0
"so as woh say, all achha things zaroori come ko an end.",0,neutral,5,2.0
jab tak railway ko politics se free nahi kiya jaega tab tak kuch nahi hoga,0,neutral,5,0.0
#shameonptvsports awam ko cricket se mehrom rakha hai @ptvsp0rts @ptvnewsofficial,0,fear,3,2.0
koi apne naam k aage or plchhe ram lagaker aur koi ram ka naam pr gandi politics krke bhagwaan ram jaise aadarsh charitra ko badnaam krte ha,0,neutral,5,2.0
india me hindu muslim or dusra rajneeti politics karka desh ko sab barbad kardega.islia hamara desh ajj bhi picha hai #hindugirlsforisis,0,fear,3,2.0
good politics.aarmy me bhi aarakshan de do pata chal jayega,0,joy,0,3.0
rahul gandhi: mummy ka naam bhi hai kya? #ramrahimsingh #politics #pappu,0,fear,3,3.0
"ho tum kidding? main love woh guy! morning's here! morning hai here,",0,joy,0,3.0
"haan bhai, pollution control perfect hai",1,joy,0,0.0
"excuse mujhe, i'm thirsty, so i'm going ko go ko tha refrigerator aur get myself a refreshing beverage.",0,neutral,5,5.0
@bjp4india @rssorg but sir gaye ki khabar kya karni hai apke jaise suvar ki khabar roj mil jo jati hai. ,1,anger,1,4.0
rahul ji aap log yeh kisi k bhi marne per politics mat kariye please marta hai jiska usko pata chalta hai aap to apni roti sekne jate hai,0,neutral,5,4.0
poor batting by pakistan team. 330 bhi nahi bana paye. #indvspak #asiacup ,0,anger,1,4.0
mujhe bollywood stars ke naam na sunaai dete hai na dikhaayi bas ek superstar ka naam sunaai deta hai s r k,0,joy,0,1.0
"aree vaiya, rohit sharma aur shikhar dhawan alag alag admi hai aur cricket khelte hai. sab ek kardiya apne",0,neutral,5,5.0
"haan bilkul, job chhod do dream follow karo",1,joy,0,5.0
"yeah well that's kyunki uh . main stayed mein mera room. yeah, tum don't want ko look mein mera hamper.",0,neutral,5,5.0
bichara cricket khel nahi sakta kam az kam dekh to sakta hai,0,neutral,5,0.0
ye sab tum politics ki bajah se kar rahe ho isse new india ka kya connection ye baba log tum logo ki hi bajah se paida hue hi,0,neutral,5,0.0
saam dhaam dhand bhed _ chanakya of politics _ amit shah,0,neutral,5,0.0
cool raj kaho na pyar hai scen @ihrithik #hrithikroshan #amishapatel #hrithik #bollywood #tweetme #indian #video #hrpic.twitter.com/g9i9wew7ks,0,fear,3,2.0
"haan bilkul, administrative reforms resolve hone wala hai, bass intezaar karo 10 saal aur dekho",1,neutral,5,2.0
"haan haan, agriculture toh solve ho jayega, jaise pichhle 70 saal mein solve hua",1,neutral,5,0.0
"main read a study online woh walking after a meal not only aids mein digestion, lekin increases serotonin, aur tum know mujhe, if there's ek thing main like zyada than a refreshing beverage, it's serotonin. bye-bye.",0,joy,0,5.0
"#captionthemoment #micromaxcup #indvssl "" badshah hai cricket ke kaam me na kisi se kam naam to suna h hoga shikhar dhawan""",0,fear,3,3.0
"let's see p.m modi kya qanoon banate hai or ye bhi dekhte hai k kitni politics hoti hai 3, talaaq pe",0,joy,0,3.0
humare desh ki kuch anchors aisa reaction hai jaise unke pati unko pehle #tripletalaq de chuke hai,0,anger,1,1.0
my parents: beta padhai kar. crypto,1,neutral,5,4.0
jangla buss per lahori itne khush hojatay hain ke inko daaku bhi rule kareyn toh ye unko choomtay hain # #na120standswithpmln,1,anger,1,4.0
"bhaiya koi saaf sutri jagah dekh k gaadi rok na, mutna hai' #",1,joy,0,1.0
@sambitswaraj patra ji.aaj kya maun varta h.baba pe kuch ni bolo.triple talaq pe to bhut kood rhe the,0,neutral,5,5.0
"that's bahut thoughtful, lekin main think i'll finish mera coffee first.",0,joy,0,5.0
bibi .ye referendum koi triple talaq ya halala nahi hai hai jo koi bhi aira gaira mulla karwa de.read the un resolution first,0,neutral,5,5.0
jara apna aur bap ka luta hua.paisa in garibo pe to kharch kar.apne aap ko leader kahte ho.aur ek apne janta pe politics karte?,0,neutral,5,0.0
sar pe laal topi roosi phir bhi dil hai hindustani #psiloveyou #merepaaspetsutrahai to add #bollywood drama whatsapp us at 9599786585. pic.twitter.com/otrkfrzoff,0,joy,0,5.0
"play #dream11 game @imkccricket #pak11 by #kcfantasynews zaman, shehzad, azam, malik, sahmed, imad, shadab, fashraf, sohail , hali, raees.",0,fear,3,3.0
70 saal mein kuch upaay kiye hote to aisa nahi hot tum to desh ko lutney ke chakar mei they ab politics khel rahe ho,0,neutral,5,2.0
"oh, you're hardly out of tha woods, nahi tum still run tha risk of infection, a blood clot, tha possibility woh an inattentive surgeon let a barn spider lay eggs mein tera nose.",0,fear,3,2.0
"@aamaadmiparty mazey ki baat dekhiye, protest karne vale bhi #gandhi ke follower aur todne wale bhi. gandhian # :)",1,anger,1,2.0
us ka rawayya dekha jaye ga first 2.5 years mai agar wo theek raha to phir usay cricket khelne ki ijazat mil jaye gee like asif salman amir,0,joy,0,1.0
ham balocho ko smaj aa gye k pak army hi ha jo is mulk k liye kuch kr rhi ha baki ye politics waly to bas pait bar kr bhar,0,joy,0,0.0
corrupt wo nahi jis nay tankhwa nahi le.corrupt wo hay jo tankhwa halal nahi kar raha politics kar raha hay. #roksakotoroklo,0,anger,1,1.0
"kabhi edher kabhi udhar, achcha lagta hai, politics mein.khattar should resign.",0,sadness,2,1.0
cricket main tabdeeli franchies & sponcer ki wajah se aa rahi hai. kaha gaya k franchies lene k liye koi tayyar nahi hoga. najam setthi,0,joy,0,2.0
bhai yahi performance dekh kar hi opp ne chal chal kar un ko phasaya aur un ko cricket se door kardiya,0,joy,0,0.0
"#tripletalaq millat me inteshar, kamyab hui sarkar",0,joy,0,0.0
"@bharatkeveer #bollywood .yahan pe laundiyan khel khel rahe hey, tum nautanki karte raho.apne baap ki izzat rakh lo #happybirthdaypm",0,joy,0,0.0
"bc shadi bhi phone pe triple talaq bhi phone pe salo lala bhi phone pe paida kar lo, aur bhej do bhari bheed mein futne ke liye.",0,neutral,5,5.0
"kuch kaam roz karo to addiction ban jati hai.bachpan se padh rahi hu, aajtak addict nahi huyi. #",1,anger,1,4.0
aaj kal politics karte karte rastra ke uper sabal ho gaya ? mujhe bahat dukh lagta he isi baat me.,0,anger,1,0.0
"healthy eating try kar raha hoon, feeling good",0,joy,0,1.0
jis prakar sachin sar ne cricket me aham bhumika nibhaie usi prakar is chetra me nibhaeyange,0,neutral,5,5.0
ye bhi politics hai.aisi rehamdil saja milti hai india mai tabhi to rape hote hai continuous.,0,anger,1,4.0
"aapko islam mein ho rahe hallala, polygamy, triple talaq jaisi najaayaz harkaton se barbad ho rahe insaanon ke bare mein bhi sochna chahiye",0,neutral,5,4.0
tumhara leader bhi waisa hi hai. triple talaq pe kuch nahi bolega . kyun . kyunki . muslim vote ka sawaal hai,0,neutral,5,0.0
patience important hai growth mein,0,neutral,5,0.0
triple talaq is gsted now. samjhe.? nahi samjhe to ghanta samjhoge tum!,0,surprise,4,1.0
chhat pe cricket ke liye bat ki jagah thapi aur akhbaar ke upar dhaga lapet ke banai hui ball.,0,anger,1,3.0
triple talaq ke decision ke bad tujhe nind to ayegi. lol,0,neutral,5,4.0
"bhagwaan khud bolega ""bhosdike, cricket 07 nahi hai ke tu cheat code daal ke jeet jaayega"" kabhi kabhi harr mann liya karo. marr nahi jaoge!",0,neutral,5,0.0
#picnicingorakhpur behtar hota rahul is lailaaj beemari ko khatm karne ke liye politics karte. par unmaad failana congres ka kam hai,0,joy,0,5.0
"hindustani jaisa bhi ho, usse do cheezein bilkul pasand nahin . ek hai cricket mein haar . doosra apne desh pe vaar",0,neutral,5,5.0
yeh tanz. ore politics ka. waqt naheen insani. jaanoo ka masla hai bai anna ka masla naheen banana chaeay,0,neutral,5,0.0
"@yogi_adityanath uttar pradesh me rehna hoga, yogi yogi kehna hoga! bolo yogi ji kab bhej rahe ho apni sena ko kabristan,rape karne?",1,anger,1,4.0
daily we see trends like #attockbhuttoka #sukkurkhanka #sawatbhuttuka #sargodhaptika ye politics hay ya cities qabza karnay ka muqabla?,0,fear,3,2.0
@anjumkiani aik pagal hi pagal khanay ko shadi ghar bana sakta hay. #ppp #pakistan #,0,fear,3,0.0
ab responsibility jaisi koi cheej rahi he nhi.aaj ke leaders apni nakami ko dusro par thopna jante hai. gandi politics sir. very shameful,0,disgust,7,4.0
bhai jab ye kutte log triple talaq ko sadak pe le aaye to hum b inka koi b matter personal nahi rehne denge.,0,neutral,5,2.0
"log kya kahte hai kya nahi wo hakikat nahi hoti ,aaj hum sirf politics agende main ji rahe hai news wale or netao ki soch ko ji rahe hai",0,neutral,5,0.0
@ndtvravishkumar .desh aage badh raha hain toh kya gas cylinder ka price aage naa badhe.  #garibokisarkar @pmoindia @officeofrg,1,anger,1,4.0
ram rahim ne @imvkohli ko cricket sikhaya aur @ranveerofficial ko fashion ke tips,0,fear,3,2.0
"well ah, i've raha kar raha a lot of thinking, aur main look par mera life",0,neutral,5,2.0
tha blunt instrument woh hoga ho tha focus of mera murder trial?,1,neutral,5,0.0
vote bank politics jabtak hogi desh aise hi chalega desh ki chinta kisko hai sabko apni party ki sarkar ki chinta hai,0,neutral,5,0.0
hota hi sir aisa time bhi ata jab apke liye kuch bhi accha nahi jaa raha ho cricket main aisa bhi hota hai sir,0,joy,0,5.0
reading habit develop karne ki koshish,0,neutral,5,5.0
"triple talaq kya ban hua , mulle aise chilla rahe hai jaise inki lulli hi kaat di ho",0,joy,0,5.0
"triple talaq bjp ke influence se ho sakta hai tere hisaab se aur ye bjp ke influence se nahi huya, chup kar be, din bhar bakchodi karta hai",0,anger,1,1.0
"another motivational speech, life changing",1,joy,0,1.0
#talaqnewlaw agar congress triple talaq ka virodh kr rahe hai to kapil sibbal kyu nahi ye case chod rahe hai.,0,fear,3,3.0
mark my word ek time aesa bhi aega jab emraan hashmi bollywood pe raaz krega. talented logo ko kabhi na kabhi rasta mil jata hai.,0,neutral,5,2.0
"sarkar ke bharshtiyachaar se le kar, cricket team ki haar tak. har baat pe naraaz hey humare desh ki janta.",0,joy,0,5.0
politics itni bhi nahi khelni chahiye ki hone vale dango ko bhi na dekh sako dedicated to bjp,0,neutral,5,5.0
kuchh naya hogaa? cricket k baary mei?,0,neutral,5,0.0
i'm supposed ko teach a graduate seminar there mein ten minutes.,0,joy,0,5.0
abhi mujh mein kahin baaki thodi si hai cricket : dhoni.,0,neutral,5,5.0
ah tera own brand of vigilante justice.,1,neutral,5,0.0
wahi wahhhh ab village or city me koi farq nhi rha politics wale wahn bhi ghotale kr rhe h or wahn bhi wahhh,0,joy,0,5.0
achhi baat hai. apne cricket captain ko bhi sikha diyo. khusa hafiz.,0,neutral,5,5.0
triple talaq b to ban h bhut jagah. to wo baat q bhul jate ho?,0,neutral,5,0.0
bhai party politics se upar badho betiyan maari is rahi hai,0,neutral,5,0.0
"@sirsunnydeol jitni politics unke sath huwi hai, kuch pata bhi hai tumhe, ye film nahi hai 17 year barbad kiya hai unhone,",0,sadness,2,3.0
mere ko to ea cricket 2011 khelne se fursat nahi hai yadein bhi isi ki aati hai,0,neutral,5,3.0
"this is really helpful, thank you so much",0,joy,0,5.0
politics is more than #newindia . wah bhaiya ji wah aise to aap aa hi jaoge satta me,0,fear,3,3.0
friends ke saath plan ban raha hai trip ka,0,neutral,5,2.0
tu 90% films ko flop bolta hai jo ki bollywood me normal hai.90% films flop hi hote hai.koi bada baat nahi hai isme,0,surprise,4,1.0
shame on indian dirty politics. shaher jalane walo ke liye pm sahayata kosh khol diya gaya.h. gaw rakkhako ko gundai ka license diya h.,0,disgust,7,3.0
sirf @bjp4india apni politics chamkane k liye itni bheed jama karli. magar dhau ulta pad gaya. lene k dene pad gae,0,neutral,5,2.0
bollywood icu me hai. dr akshay kumar 11 aug ko surgery karne wale hai. hope sab kuch accha jaaye,0,sadness,2,3.0
yaar ye movie dekhi? kaafi acchi lagi mujhe,0,neutral,5,3.0
"apto tumhen itminan hua instant triple talaq khatm hone se, so i hope ab apni didi ki shadi muslims se karoge?aur muslim jija banaoge",0,joy,0,5.0
check kiye usme unhone kaha tha triple talaq walo k pichwde pr laat marni h so ho ho gaya. tm ni dekh paye the,0,neutral,5,5.0
aap logo ke jivan ki commentary achhi kar lete ho. cricket kyu nahi try karte,0,neutral,5,0.0
hosh kar @ecb_cricket #engvwi,0,fear,3,2.0
"tumse pehle jo insaan yaha pe takht-nashi tha, usko bhi khudpe khuda hone ka itna hi yaqin tha! #india #politics #today #truth #sher #urdu",0,anger,1,2.0
sir ji cast ka politics aap jaisa dummy leader jo aaj tak aapna koi base nahi bana paye ek chhor se mp ka election haad jate hai,0,neutral,5,4.0
o bahi ptah bhi hai politics ka. lay kr london bhaithay hao. aoo apko aik chakar lagwaun in ilaaqoon ka. wahan awam ki soch kia hai.,0,joy,0,5.0
jaha ye opposition me hai vaha inko tregedy pe dukh hota hai ye politics nahi hai to aur kya hai. chuha 56 inch ka,0,joy,0,0.0
hey.,0,neutral,5,5.0
jo triple talaq nd halala ko support kare use sanskar ka kya pata rahega.so tumhare jaison ke mukh se achhi baaten nikle wo sobha nahi deti,0,neutral,5,0.0
vote politics? or pressure from dalit.?. modi to harami neta nai hai na. wo hataye. phir dekhte hai tumhare dalit bhai ka brotherhood,0,neutral,5,0.0
@cmofficeup bhut manta hu yeh sab dekh kar politics pr bharosha uth jata h ##reply.#kare.#please.,0,sadness,2,3.0
@flypigmk uski gand mein dum hai. agar kisi aur ke gand mein nahi hai to uske baap ka kya jaat hai.  with #gand,1,anger,1,1.0
tech updates follow karta hoon regularly,0,neutral,5,4.0
"tum nay knsa top karliya kahin par apny parents ki khoon paseeny ki qamae sa, dosro ko dars dy rahe ho # #pakistanzindabad #kuchbhi",1,anger,1,4.0
"*chinese president tweets in hindi* ""kamino.tumhara triple talaq aur ramrahim ka topic khatam ho jaye tho meri dhamki pur bhi focus karna",0,neutral,5,4.0
ye sale ka vote bank politics har vakth. ye andha hai hi our log jo baba logo ka pooja karthe hai usse jyada andhe,0,joy,0,5.0
@sharjeelleo14 ab ja k allah ko yaad karo chordo cricket ko e aur kam karo bhai apko @im_salmanbutt aur @iamamirofficial samjha gaya,0,anger,1,1.0
lagta hai bollywood movies kuch jyada hai dekte hai aap. iske pehle china ne kabhi troops ko itna aage laane ki himmat nahi ki thi.,0,neutral,5,4.0
toilet me jet se itna garam paani aata hai jaise manikaran se paani ka connection le rkha ho  #summers17,1,anger,1,4.0
ye umar akmal bhi koi aakhri attention ka bhooka hai. cricket ki veena malik.,0,neutral,5,4.0
#tripletalaq aur mujh jaise ko gond wala glass pasand nahi islye todne se phle das baar sonchunga.warna gond jisse hala kahte he lgana hoga,0,joy,0,5.0
ye cafe ka ambiance bahut accha hai,0,joy,0,0.0
sharab toh yunhi badnaam hai nasha toh india me cricket ka chal raha hai #virupanti @virendersehwag @starsportsindia,0,fear,3,3.0
yaha baat #bjp or #congress ki nahi ho rahi hai yaha baat brave indian soldiers ki ho rhi hai har jagah politics theek nahi,0,fear,3,0.0
muslims vote bank politics ho sakti hai toh hindu votes par kya zeher chadha hai bhai sahab.,0,neutral,5,2.0
aadat se majabur .filmo ko chod cricket me apana jalawa bikher rahi he ab,0,neutral,5,0.0
sheesh! @anggaadhitya #ikhlas #positivityisthekey ---> ,0,fear,3,2.0
@ella_joy23 haa haa ,0,anger,1,2.0
sumit awasthi jaise log abhi triple talaq jaisi world ki sabse badi problem se chutti nahi pae hai ye to choti problem hai sir j.,0,neutral,5,4.0
chopra saab n sadharu bharatha cricket jattu kreedabhimanulu,0,neutral,5,0.0
bahut ghatiya hai @bollywood_life wale.waise bhai saalon ko rt aate hi nahin hai. hahahaha. #ihatebollywoodlife sahi mein chu hain,0,anger,1,4.0
"look, kripaya, kripaya don't go anywhere, okay?",0,fear,3,2.0
"photography hobby hai meri, enjoy karta hoon",0,joy,0,3.0
@msisodia sir khel li na politics.vacancy ko vapis lekar. ab yahi hai bs tumhara. phir nikalte kyo ho jb vapis hi leni ho to. #shameonyou,0,anger,1,1.0
chutiye apne kam kbhi nhi bhulte hai hmesa kr hi dete hai #politics keep it up,0,anger,1,0.0
sabse zyada sukh deti hain is duniya main . -aurat . sabse zyada dukh bhi deti hain - aurat . #,1,sadness,2,1.0
aur here main am mein tha trap. tum just keep talking. i'm gonna chew mera leg off.,1,neutral,5,3.0
aaj mausam to bada shaandaar hai ,0,anger,1,4.0
@shoutinggod kya kare! hum diet bhi kare toh unhe bura lag jata h. aur wt gain k bare me zyada taunt karnewali bhi wahi #,1,anger,1,0.0
maaf kar de bhai sahib. aap triple talaq mein phd karein,0,neutral,5,4.0
zardari nawaz ne ek dosre main corruption ka ilzaam laga ke phr sath ho jayein to yeh pakistani politics ha aisa he chalta hai,0,sadness,2,3.0
@narendramodi politics se desh banaao desh badhaao desh ko dekho desh ka kaam karo desh par dhyaan lagao desh ke liye drama karo,0,neutral,5,3.0
logic dhang ka diya karo lallan fans. dheere dheere pure bollywood ko pta chal gaya hai ki lallan ka lulli chota hai. chhakka hai chhakka,0,neutral,5,0.0
"usme bhi politics desh ko barbad kiya usne, muslim hated thi uske sath esa hi hona tha",0,anger,1,4.0
gali cricket mai bhi naali se ball nikalne ke liye khelne wale ab pv sindhu ko gyaan denge pic.twitter.com/uhnuf3vivw,0,neutral,5,4.0
na bhai na. tumse na ho payegi. tum triple talaq ka case lado,0,neutral,5,0.0
#lahore: #world #eleven ki aamad #pakistan ma aalmi #cricket kali aham qadam ha yeh #cricket sa kahien barh kr ha. chairman #pcb najam sethi,0,fear,3,2.0
jo kabhi ram setu ko na maante the. aaj unhi ka sahara le rahe hai court me #tripletalaq #shameonyou,0,fear,3,0.0
akhilesh yadav ji aap kisi ke bhi laas ke sath politics kar sakte hai. wah,0,anger,1,2.0
"dekho pakistaniyo, madrasso mein jaao, allahu akbar bolo, bakriyo ke saath so jaao. ye global politics tumhare bas ke baahar hai.",0,neutral,5,4.0
delhi me bhi barish hoti hai ?  #rakshabandan #delhirainpic.twitter.com/rtpnpegkvk,1,anger,1,4.0
nawaz shareef aj bhi politics karne aa gaya ha inteha ka beghairat admi hai,0,neutral,5,4.0
"book padh raha hoon요즘, interesting story hai",0,joy,0,5.0
"sir desh mein chutiyon ki kami nahi hai ,ek dhoondo hazar milte hain jaise ke ye presstitute. dard mein bhi politics karate hain.shameless",0,neutral,5,5.0
"proud of you bhai, mehnat rang layi",0,joy,0,5.0
sabhi vote ke liye politics karte hai.bjp ne kiya to kaun sa naya khel khela.sab aik hai.general wale marte rahe.inki rajneeti chalegi,0,neutral,5,5.0
07 september #bollywood #nostalgia 1981 jail yatra 1984 aaj ki awaaz 1990 sher dil 2007 dhamaal 2007 apna asmaan,0,sadness,2,3.0
inki south ki movies bhi badi acchi rehti hai. action scene me bollywood me shayad @taapsee hi ek hai aur koi bhi yaad nahi aata,0,joy,0,2.0
bhajji ab to tumhara cricket me wapas aana mushkil lag raha hai. aage koi position bhi nhi milegi. waise bat thik hi ki hai.,0,neutral,5,5.0
pakistan se jis din se hara hai cricket dekhna band kar diya hun,0,neutral,5,0.0
lens naayak photography #bollywood #portfolio #photographer #indian #india #mumbai #bombay #hindifilms #serials #tvc #advertising #garmentspic.twitter.com/dnudq6jj55,0,fear,3,2.0
small steps taking towards goals,0,neutral,5,2.0
"nahi, i'm just allergic ko people who get nobel prizes ke liye nahi achha reason.",1,neutral,5,0.0
swimming pool ki spelling aati hai tumko @likeappofficial #followme #musicallyindia #bollywood #cinema #film #acting #thestreak #weekendpic.twitter.com/qsuxmgkdsz,0,joy,0,5.0
aaj #aapkiadalat dekhne ke baad kisi bollywood star ka twitter kaam nahi karega . jo #kanganaranaut ko sahi ya galat bata sake .,0,joy,0,0.0
triple talaq has nothing to do with these numbers! pata nahi side argument kyon dete hain log wo bhi aap kaise?,0,neutral,5,5.0
muslim mahilaon ke bachchon ko reservation digiye kya triple talaq hi mudda hai dusre mudde nazar nahi aarahe hain ya dikhnahi raha hai,0,neutral,5,0.0
"meenakshi ji, mujhe toh lagta hai farzi baba, keh darzi log kejriwal se na mill jaye,aur ek baar fir se dharna politics na shuru hojaye.",0,joy,0,5.0
@kp1200 pocket main uske aas pass bhi nahin hai! #,0,joy,0,0.0
tum ho ko stop tha q-tip when there hai resistance,1,anger,1,1.0
bhai yeh kaisa freedom of speech hai jaha har baat jo acha nahin lagne pe pakistan jaane ki baat karte ho. #,1,anger,1,0.0
60 saal tak kachra karne waalo ko 5 saal me desh saaf chahiye # #demonetisationsuccess,1,fear,3,2.0
india me hi bakcho. kar pate hai. neta logo ka vote bank ka sath. wohi ghisi piti kuch gande logo ki politics,0,neutral,5,2.0
"auratjat kya sosit nahin horahahai,4 surat ke liye ek mard,fir triple talaq,fir halala,aurotonko bacha paida karneka machine banadiya gaya",0,neutral,5,0.0
board games session plan hai evening,0,joy,0,5.0
"oh wow, chatgpt se answer copy kiya",1,surprise,4,4.0
"swachh (sweep), bharat. in sri lanka. #cricket",0,anger,1,3.0
"oh great, another selfie with your car",1,joy,0,1.0
grateful for opportunities milne wale,0,joy,0,0.0
@spn_cricket agly maich me kohli ko aaram karna chahiy,0,joy,0,0.0
@saniakhanhyat zara sabar kar jao ye koohsat meynmar say bhi cricket khelnay ki ratt lagaey ga,0,joy,0,0.0
triple talaq khatam kar denge toh halala ka taste aur paise kaise milenge. lol,0,neutral,5,5.0
tax system? woh toh bass election time mein yaad aata hai,1,surprise,4,1.0
rajesh khanna jaisi star power bollywood main na thi na hai aur na kisi ki ho sakti hai,0,joy,0,4.0
agar ladki ulti karti hai to uska ek hi karan mana jata hai ki woh pregnant hai ! #bollywood,0,joy,0,0.0
"#nowplaying zindagi ke safar mein guzar jaate hain jo muqaam. woh fir nahi aate,woh fir nahi aate :\ #lifeisharsh",1,fear,3,3.0
