text,label,emotion,emotion_encoded,emotion_shift
"while playing #holi #dhuleti :-- arre beta, ye paani toh ganda hai.kisi achhe insan pr daalo #festival ",1,joy,0,1.0
"@mohsinhijazee charagh tale andhera, khud nahin kare sake nibah, lekin oron ko mashwre ! #",1,anger,1,1.0
apne kya kiya un bachon ke liye. tell me one thing. sir kabhi to politics se upar socho.,0,neutral,5,4.0
"sabko holi par he pani ki barbaadi dikhti h , in logo ko cricket grund mei lakho ltr barbaad hone wala pani kyu nahi najar aata ?",0,neutral,5,0.0
hindi filmo ki piracy ka standard din-b-din girta ja raha hai :-( #bollywood #hindimovies,0,fear,3,2.0
#bollywood shenshah amitabh bachan ke khilaf bhi #panamacase khul gaya. #india me amitab ke sath 33 indians k khilaf #panama inquiry shru.,0,fear,3,0.0
sanjeev kumar in rare promo for shandaar (1974). #sanjeevkumar @bollywoodirect @vintagemuvyz @bombaybasanti #bollywood #bestactor #handsomepic.twitter.com/frvfdid3an,0,joy,0,3.0
@mariablanc0 pc pe my sis ne qabza kia va hai. laptop to ja chuka hai. qmobile se change nahi hoti and tum b dramay kar rahi ho # #sad,0,sadness,2,2.0
"not bahut, lekin woh seemed ko ho mein a pretty achha place.",0,joy,0,2.0
bhai hum sab bhi door rahte thy.mai bhi politics mai koi interest nahi rakhti thi.sirf textile designs ke baare mai hi jaanti thi,0,neutral,5,5.0
"congratulations aur swagat temporarily aboard. here's tera i.d. card, tera key aur tera lapel pin. which leonard tha too cool ko wear.",1,joy,0,5.0
"karachi: #pakistan cricket team ka capton sarfaraz ahmed baray bhai ka hamrah maweshi mandi pohanch gaye, qurbani ka janwar kharid liya,",0,fear,3,3.0
"another pizza post, never seen before",1,surprise,4,1.0
"abe aoni ammi ka dhyan rakh, kahi abbu triple talaq na dedw aur koi halala ke naam pe teri ammi ka puncture na banade.",0,neutral,5,1.0
congratulations bro! bahut khushi hui ye sunke,0,joy,0,5.0
yahee ek desh hai jahaa 1947 ke ng family se le ke momota tak sirf vote bank ki politics karte hain,0,neutral,5,5.0
aaj tv me aapke mukhyalya ke sambe launda nalla dance dekha. aap logo ke kabiliyat pe hame kabhi sak nahi tha. bewkofo ki politics rjd,0,neutral,5,0.0
"abhi ye behas nahi k kon aa raha hai, kon nahi. cricket honi chahiye. abhi koi bhi ghair mulki khilari aenge to acha hai. wasim akram",0,neutral,5,0.0
"kitne sharm ki baat hai,ye congresi sale bachhon ki maut pe bhi vote bank ki politics karte hain.congress aur terrorist dono ek hi hain.",0,fear,3,2.0
muavja 1 aisa word hai jo neta apni dirty politics ke liye use karte hai mujhe aasa hai yogi g is bat ko samjhege,0,disgust,7,4.0
aaj bjp aur chadhi gang aise khus ho rahe hai jaise triple talaq na ho balki 1962 ke china se badla lekar aaye ho bc,0,anger,1,6.0
"your support means a lot, thank you",0,joy,0,1.0
long drive wala mausam aur sadkon pe gaddhe #,1,sadness,2,2.0
#tripletalaq ko aur #ramrahim ko rote raho bas,0,fear,3,1.0
kanoon majhabi ho par mulk dharm nirpeksh gazab chahat h logo ki rt=agree #tripletalaq @sardanarohit @nitu_ji @bobbydeol0 @nikkynikky6,0,anger,1,2.0
#tripletalaq kutte ko agar meat nahi milta he to wo bhonkne lagta he jabke usse maloom ki bhonkne se kuchh nhi milta.to faltu mat bhonko.,0,anger,1,0.0
"haan haan, budget allocation toh solve ho jayega, jaise pichhle 70 saal mein solve hua",1,neutral,5,4.0
"kya else? sell woh par ebay as ""slightly used.""",0,neutral,5,0.0
aaj puri india ke liye utsav se kam nahi hai jo bharat ne cricket me karnama kiya sl ko 9-0 se haraya kohali ko very very congratulations,0,joy,0,5.0
saram hinduo ko aani chahiye bollywood ke bhi kuch log h .sonaam kapoor jaisi muslim dalal bhi .jinki hindu movie dekhne jate h,0,joy,0,0.0
@bollywood_life vaani kapoor pehle bhi model thi aur ab bhi model ban kar hi reh gayi hai,0,joy,0,0.0
"sallu bhai, aap abhi bhee bahut smart dikhte ho. bollywood join karlo bahut free time hai aajkal. u can challenge original sallu bhai.",0,neutral,5,5.0
akhilesh ji aap abhi yuwa hi politics aisi kariye jisse massumo ki jaan na jaye plz,0,neutral,5,0.0
"fam, plans final karo jaldi",0,sadness,2,3.0
ek set hai logon ka. jo bachpan se bollywood film dekhte bade hue hain. har film dekhte hain. kuch daily ek dekhte hain. poore filmy.,0,joy,0,2.0
aise bol rhe hai jaise khud jhanda gaar diye ho politics me ek parbkta hai usi me apne aap ko kya samjh rhe @tejyadav14,0,anger,1,1.0
muslim mahilaon ko insaaaf mila to jashn #tripletalaq hindu mahilaon ko insaaf mila to shahar jal gaye #babaramrahim @sadhavi @faridapatel,0,fear,3,2.0
main think tonight tha a bahut achha start.,0,neutral,5,2.0
bollywood industry me talent bhi bhot hai or chutye logo ki kami bhi nahi hai.,0,neutral,5,0.0
teen bar talaq bolo to nai begam milti hai aur teen bar ram bolo to bhagwan milte hai #tripletalaq,0,anger,1,4.0
kuch logo ka number iss liye save krte hain ki galti se uth naa jaye.  @vyasishit @shubham_14994 @_raj_parmar_ @the_adson,1,anger,1,0.0
aaj sari badhai yahin mangoge? jahan khud faste ho uska koi jawab nahi dete. dhoortpan lekar paida hue the ya politics me aane ke bad sikha,0,neutral,5,4.0
gud luck of yuvi. rt @themotumaster: yuvraj singh & rajnikanth share the same birthday! is it an # ?,0,joy,0,5.0
@sambitswaraj ji aapko lagta nhi ke aap ke chahiye bhaiyo ko bhi politics m aana chahiye.ya app bhi sir khujkiwal ban gye ho,0,neutral,5,5.0
"bahut accha content create karte ho, keep it up",0,neutral,5,0.0
abe chu chu triple talaq bhi gya.,0,neutral,5,0.0
"aur kaise difficult woh hai ko karo when she's bloated, cranky aur crampy?",0,anger,1,4.0
sir india gadhe ki tarah religion/politics ke pichhe daud raha hai aur progress ki taraf tambura nahi dekh raha,0,neutral,5,4.0
budget friendly aur quality bhi acchi hai,0,joy,0,5.0
"main am maafi, ham donõt ho tera sheep.",1,joy,0,0.0
kahen aisa tu nahi ke #pak cricket team ki tarah sirf start he acha liya ho #na120 #pti #pmln,0,fear,3,3.0
"oh wow, whatsapp forward pe believe kar rahe ho",1,surprise,4,1.0
tu iska video triple talaq pe dekh tujhe pta lag jaega kitna sahi bolta hai ye aur hmne bhi granth padhe hue hai ulta bolta hai ye ye,0,fear,3,1.0
hamere desh triple talaq se bhi jada dahej utpidan case he to him logo ko dhej utpidan ka bhi kanoon banana chahiye,0,neutral,5,2.0
"@anjanaomkashyap aap #tripletalaq k debate me cut mulla bol rahi thee. iska matlab pata hai, agar ha to matlab bataye @asadowaisi",0,fear,3,2.0
bhai koi esa banda hai jisko indore cricket match ka ticket mil gya hai. uske charan chuna hai mujhe,0,neutral,5,2.0
ha yaar gujjus sirf kathiyawaadi log nhi hai ye baat bollywood aur t.v serialwaale samaj le to acha,0,joy,0,5.0
triple talaq muslim samaj ke purushon ke hawas ka intizam tha.,0,neutral,5,5.0
#pakvwxi itna small ground to hmare guly cricket main bhi nahi hota hai.aur @babarazam258 ko @imvkohli batate ho.kha raja bhoj kha gangu tel,0,fear,3,2.0
2 months of no cricket for me.par abhi bhi rohit ko open krte hue dekh dil dhak dhak hone lgta h,0,sadness,2,1.0
raja thakur bihar me badh k karan halaat kharab hain aur tum politics batiya rahe ho. wah re jan neta.,0,neutral,5,3.0
"aaj aap ram dev baba ko hi dekh lo, sirf sirf bjp aur modi ke chalte hero ban gaya. yah bhi ek politics hai",0,joy,0,5.0
"jeene ke aarzoo mein mare ja rahe hain log, marne ki aarzoo mein jiye ja raha hoon main. #",1,sadness,2,2.0
"another scam, surprised? not at all",1,surprise,4,2.0
nepal ko cricket game ko upalaabdi dekhera sarai aananda aayo bhanaya,0,neutral,5,1.0
"kal shri ram ko laaye triple talaq par, aaj keh denge k ram ji ne seeta ka tyaag kia' pehle uspar baat ho. uska decision aae.",0,neutral,5,0.0
"yeah, main mean, woh hota ho rude ko unhe ke liye hamein ko leave now.",1,anger,1,4.0
open source contribution start kiya,0,neutral,5,4.0
pakistani cricket ka aaj halala hoga. usk baad iska dbaara se nikkah ho jaye ga icc se. #cricketkihalalala #pakvwxi,0,fear,3,2.0
bhai bade sophisticated way me hindi bhasha ki khilli udayi hai iss film me. urdufilm ind bollywood hindi ko destroy karne me villain hai,0,anger,1,2.0
hindu muslim se pehle hum insan hai pareshni ke samay ek dusre ki madad kare.jo politics krte hai wo aap k kaam nahi aane wale,0,neutral,5,4.0
@amishdevgan bhakt how are you modi & bjp bhakt. mard ka bachcha hai to yashodaben ka haqq dilana namard kutte triple talaq par mind washkrk,0,neutral,5,0.0
akshay kumar - 5hits/superhits in 20 months achche din akki ke hai yaa bollywood ke? samajh ni aa raha,0,surprise,4,1.0
#achhedin aa to gae hai par kohre ki wajah se dikh nhi rhe shyd #modi #modibhakts #height  #india #pm #newyearwithgoeventz,1,anger,1,3.0
"me to someone ""yaar, pakistan waale india ko buri tarah peet rahe hain. matlab kashmir waal jashan mana rahe honge"" ",1,anger,1,0.0
"india ke liye mahi bhai ka rahana jaruri hai , virat run mashin hai magar m.s dhoni hi india ka cricket aage le ja sakta he virat nahi",0,neutral,5,4.0
@akshaykumar indra canteen ki jagah wo paisa hospital ko bhi de sakti thi #congress . par nhi gandi politics jo karni h.,0,fear,3,2.0
cricket ka bhagwan kitna bechara lag raha hai. is bhagwan aur iski team ke liye bhagwan se prarthna karo.,0,joy,0,3.0
@nowayoj @randomeshwar maa ki  #websters #etc,0,anger,1,1.0
kuch chutiye itna bhari barish me dusre rajya me baith k devendra phanvadis ko kos rahe h haramkhoro idhar aafat aayi hai usme bhi politics,0,neutral,5,4.0
are kamino kyo apni politics 3talak par kar rahe ho ek taraf ekta ki baat karte ho or dusri taraf musalmano ke khilaf bhadkau bhasan dete ho,0,neutral,5,0.0
lovely,1,joy,0,5.0
@thaqibh dhoop k dar sey log barish ka maza bhi nahi ley patay #,0,sadness,2,2.0
"muslims jab tak 4-6 shaadi naa kare tab tak woh muslim kahan, . issliye to triple talaq hatane se darte hain .",0,neutral,5,3.0
main poora din &amp; har waqt cricket dekhta rehta tha. jab aap bache hote hain to poora din khel se dil hi nahi bharta. jasparit bumrah,0,joy,0,5.0
"commentator says, ""shikhar jaldi mein lag rahe hain. zaroor koi khaas tv programme dekhna chah rahe hain."" :d #cricket #indvssl",0,anger,1,1.0
cricket hatwaya maine waise bhi woh bezati karwa rahe hai,0,neutral,5,4.0
"another tech buzzword, revolutionary hai",1,joy,0,5.0
ye sab aap apne liye kr rhe hn taki politics mai bane rhen. flood se bihar behal h . help kren sache dil . janta insaf degi.,0,sadness,2,2.0
"haan bhai, metaverse mein ghar kharid lo",1,neutral,5,3.0
modi ko itna mat koso warna jald hi pure parivar saith mitti mein mil jaoge. had se jyada negative politics accha nahi hota.,0,neutral,5,0.0
coffee peene chalein? main free hoon aaj,0,joy,0,5.0
#triple_talaq me #naqab wali aurten kyo zada dikh rhi h? #just_a_question #padmavti,0,anger,1,1.0
"meeting productive thi aaj, achhe decisions liye",0,joy,0,1.0
"yeah, mera parents felt woh naming mujhe leonard aur putting mujhe mein advanced placement classes wasn't getting mujhe beaten up enough.",1,sadness,2,2.0
"issa vibe, loving this energy",0,joy,0,2.0
"#kpl2017 #bb 11 by kc #fantasycricket vishwanathan, samarth, bhavane, deshpande, rbhatkal, mreddy, abhat, myadav, krishna, koushik, kader.",0,fear,3,3.0
ar akmal aur sharjeel khan ko be wajah cricket se door kiya ja raha hai & javed miandaad,0,joy,0,3.0
#mondaymorning shuru karo #bhai ka naam lekar! #salmankhan #katrinakaif #bollywood #bollywoodflashback #ekthatigerpic.twitter.com/yzcvx5jvgq,0,fear,3,3.0
bhai chai peeke aata hu.thoda wait kroge ya apka shift khatm hogya.waise kitna kamaate ho per hate twt keliye.,1,anger,1,2.0
"- nahi, nahi nahi i'm sach mein achha par yeh. all right, give mujhe a hint. karta woh involve difficulty initiating a stream of anything?",0,neutral,5,4.0
har dilli wala apne ko smart samjhta hai . #,1,joy,0,5.0
sabko yeh chinta thi ki triple talaq par musalman garmjoshi nhi dikha rahe lo ab asli garmi diesel aur petrol k saath bullet free,0,neutral,5,5.0
"sir @ptshrikant abhi kewal kaam kare, bayaanbaaji ya politics performance dikhane k baaad kare @narendramodi @yadavakhilesh @upgovt",0,joy,0,5.0
yeah.,0,neutral,5,5.0
aap ki roti chin gayi hai iski pida hai aapko. par iss pida ka badla na le pradesh ke masum logon se. aur dirty politics band karen.,0,neutral,5,0.0
ha ha ha. triple talaq khatam hai beta.,0,neutral,5,0.0
corruption? woh toh bass election time mein yaad aata hai,1,disgust,7,2.0
"shuru hogye politics karne, khud jo ram leela maidan me kiye the yaad nai? abhi to mu band kar lo",0,neutral,5,2.0
ns ki to politics hee khatum ho gayee thee sh sahib,0,joy,0,5.0
psycho hai sir vo apna nahi apne hi imagination ke duniya me jeeti hai waise bhi ye bollywood me anne se pahle hi hr ki deewani thi,0,joy,0,0.0
"haan bilkul, election promises resolve hone wala hai, bass intezaar karo 10 saal aur dekho",1,neutral,5,5.0
"when someone question triple talaq , ye shariyat ka niyam hai. gau mata hamari astha ka hi vishay hai.",0,anger,1,4.0
#tripletalaq par mithai or #ramrahimsingh pr pitai ye hy sanghi dharam apni behn k blatkari ka saport or islam se nafrat ka 1 rukh,0,fear,3,2.0
"modi ko hamesha badnaam karte ho faltu mein.woh apna credit kuch bole bina le leta hai.thoda triple talaq, aur ucc ki taraf aao",0,neutral,5,2.0
yaha insan mare hai or tu aapna politics ker raha hai.atrankwadiyo ki taradari ker raha hai,0,joy,0,5.0
ye sirf vote bank hai or kuch v nhi bjp dharm wali politics kr rahe hai,0,neutral,5,5.0
"#bollywood m hukum chahe kisi ka bhi ho, jab bhi #badshah / king ka jikar honga #google par search mar lena #shahrukh ka hi nam ayenga",0,fear,3,2.0
nahi tha dark crescent-shaped patterns under tera arms conceal woh nicely.,1,neutral,5,2.0
"amit shah jo indian politics ko ganda kar raha hai, pahele vah swachh kiji e modiji",0,joy,0,5.0
"waaat lag gai! ghar se phone aaya,poochha ,ky haal hain? hum bole, sab badiya! #",0,joy,0,0.0
chandler?,0,surprise,4,4.0
triple talaq practice ki jati hai jo maine bataya aur islam.me.hai apne joo.kaha usey nh. no legal way . triple and khula best option,0,sadness,2,2.0
@sardanarohit naisha hasan ne to bahut aacha article likha tha kal #tripletalaq pe @jagrannews main likha tha kal,0,joy,0,2.0
ab hamare desh ki muslim shadi shuda mahilao pr se at least 1 atyachar to kam hoga. baki to sab hi jhel rahe h. unfortunately #tripletalaq,0,sadness,2,2.0
"tu katlustani kutta hai kya bhaiyye aur chinua tera baap hai kya. bhai ek hindustani ki tarah bol, katue. jab desh ki baat aye to politics ?",0,neutral,5,3.0
tum know yeh sakta go par all night. why don't tum just come ke saath hamein?,0,neutral,5,0.0
paise k aagy log ghutno par aa hi jate hy #bollywood #models #actress,0,joy,0,5.0
"oh great, linkedin lunatic ban gaye",1,fear,3,3.0
@ravishkumarndtv #tripletalaq band hone se kya desh ki economy sudhar jayegi #dalitatrocity khatm hogi #vikas ki raftaar badegi,0,fear,3,0.0
it's mera friends.,0,joy,0,3.0
are bjp vikas ki politics krne aayi hi ni hai .aisa lagta hai jaise bjp wale hi hindu aur deshbhakt hai.sabse ache hindu akhilesh aur lalu,0,neutral,5,5.0
neta ji ko election promises samajhne ke liye phd ki zaroorat hai kya?,1,neutral,5,0.0
bollywood ko kya hogaya wow bro .koi movie nahi chal rahi h .kahin band naa hojaaye 2-4 saal mein .,0,surprise,4,1.0
"same to you,you too bhawadhari kaash log bhagwa bastar aur chandan key tilk ka mahtu samajhtey aur usko gandi politics mey lipt na kartey.",0,neutral,5,1.0
"sahi pakad liye. kuch bhi ho sakta hai politics me, politics me jyatatar log dil se nahi situation ke karan friend hote hai.",0,neutral,5,0.0
@bhuvan_bam bhai chutiyo or bhakto ki baat p dhyan mt diyo.ye apni maa behn ko b use krte h politics k liye or 4 paise k liye gaali b dete h,0,neutral,5,0.0
"@mrsfunnybones akki paji , filhaal training ( politics ) to chaal na rhi , chanda ikkatha ( party fund/vigrah sewa ke liye ) ho raha hai !",0,joy,0,5.0
ye alliance kis k khilaf hai? #meraekmasoomanasawal #change #karachi #politics #ppp #pti #psp #pmln #pti,0,fear,3,3.0
mai ek baat bolunga sirf ki - opposition vaalo politics chord do or is pawan 15 august ko unn shahiddo ki madad karne ka sankalp lo,0,neutral,5,2.0
"woh gave use an assistant? if main want a naya pen, main ho ko go ko tha bank ke saath wire cutters.",1,neutral,5,0.0
karo tum think penny hoga come here aur take care of hamein?,0,neutral,5,0.0
main don't think tum hota ever karo woh.,0,neutral,5,0.0
a video bol raha hai a kam ki pichay jankari kohi admi hai . baccha markay gandha politics ho raha hai,0,joy,0,5.0
isko ludo khelna nhi aara hota cricket ki baat karrhi. aur kon thi wo jo bol rhi thi kirti gaali deti,0,neutral,5,5.0
amu k mullo ki gand fati hui hai triple talaq khatam hone k baad.,0,neutral,5,0.0
ye sahi nahi bol rahe ho aap is politics ke liye kyo hindu dharm ka apmaan kar rahe ho aapko ye sab sobha nahi deta,0,neutral,5,0.0
neha jee. bilkul sahi. sehmat hu aap ke khayaal say. jee sahi hai jee bhar gaya modi sarkar say. n relegioius politics say,0,neutral,5,0.0
"cricket news: buhat acha lag raha hai ye pakistan ki kaamyaabi hai, dua hai khush asloobi k sath tamam maamilaat hal ho jaen. shoaib akhtar",0,joy,0,5.0
"yeh sambit patra sirf non bjp ruled state politics karta hai aur pur din debate debate khelta rehta hai,",0,neutral,5,5.0
"""kamino.tumhara triple talaq aur ramrahim ka topic khatam ho jaye tho meri dhamki pur bhi focus karna """,0,neutral,5,0.0
@__l_____l__ haha.dhoondhne waale to bhagwan ko bhi dhoondh lete hai.aap bhi dhoondh lo ,1,joy,0,5.0
"bhai jis akki fan ne bola wo mc hoga un salon ko bolne do fans to kuch bhi bolte hai jab media bolne lage,politics hone lage tab dikkat hoti",0,joy,0,0.0
aankh kholke dekho 5 judge mien 3-2 se faisla hua tha triple talaq mien aur right to privacy toh 9-0 se aapke modiji haar gaye,0,neutral,5,5.0
aap sirf bolte ho. haryana me hangama dekh ke samaj gaya ki aap b vote bank politics karte ho.,0,neutral,5,0.0
3 talak to khtam ho gaya ab ek cricket team bnane walo par bhi kuch ho to maja aa jaye,0,neutral,5,0.0
manniya cm sahab uttar pradesh bundelkhand me cricket par lagne wale satte par rok lage orai jalun me to ye bahut khela jata hai,0,neutral,5,0.0
"@i_ambuj bhai kabhi kabhi ho jata hai, at d time of articleship time hi nai milta tha aur ab phursat hi phursat hai.#",0,joy,0,5.0
saari chori pakdi ja sakti haii magar swimming pool mein. susu karne wale ko koi nahi pakad sakta  #naturallyhealthy,1,anger,1,1.0
aamir khan @aamir_khan #aamirkhan #priicreationz #bollywood pic.twitter.com/egsegm5zy0,0,joy,0,1.0
#cricket_news: umar akmal aur kamran akmal ko har iss coach se takleef hai jo inhain na khilai.* #waqaryounis #aqib_nawaz,0,fear,3,3.0
triple talaq abolish hotey hi. har baccha.secured aur saanth hoga na ki terrorist,0,fear,3,0.0
tho kiya hua akmal ne tho nehi mara.71 me jo pakistan ne kiya ucke liye me sirf kuch lugoko dusi manta hu. and cricket fan is everywhere,0,neutral,5,2.0
ye sab politics hai congress ke time per cause chal raha tha but sunvayi nhi hui bjp aaye hue 3 years ho gaye saja ab hui ye bhi raaz khule,0,joy,0,5.0
"ye recipe try kari, bahut tasty bani",0,joy,0,0.0
bas dard itna hai ki bharat me marne k bad bhi politics nahi khatm ho rhi chahe wo rohit vemula ho ya gorakh pur k bacche so sad,0,sadness,2,2.0
i swear. seen it multiple times. sunni gave triple talaq. ghusa thanda hwa wahabi se fatwa laya aur tan tanaan,0,neutral,5,3.0
behaal cricket badhaal ho rahi hai :),0,neutral,5,0.0
hatt be saale tu ad ka fans ho hi nahi sakta ! yaha ad ko khatam karne ki koshish me hai gayjo or bollywood,0,joy,0,5.0
koi bhi faaltu film bana lo aur 50 crore kama lo. #bollywood #chef,0,joy,0,0.0
tujhe triple talaq chaiye tu rakh but jise nai chaiye uspe kun thop raha he.masoom logo ka dard nai dikhta.,0,neutral,5,5.0
"yeah, turns out half a dozen menorahs really sets a mood.",1,neutral,5,0.0
crazy bitch!,1,anger,1,4.0
"haan haan, job creation toh solve ho jayega, jaise pichhle 70 saal mein solve hua",1,joy,0,1.0
yahya husaini jaise 2 no. lifafa sahafiyo ki waja se @umar96akmal jaise khiladi pakistan cricket ko demak ki tarah chaat rahe hen @sanaqi26,0,fear,3,3.0
"oh, aur tha science dudes want ko talk science ke saath tum. what karo tum want ko talk about-- rocks, dinosaurs, hamara dost tha beaver?",1,neutral,5,2.0
"people r fools.jaha gya triple talaq, ram mandir bla bla .sab politics hai bachu.kuch hone wala nai hai.yu he apni bhadas nikalte rahiye",0,joy,0,5.0
"ross umm, there's something woh i've got ko tell tum, there's-there's someone else.",0,surprise,4,4.0
"haan haan, development projects toh solve ho jayega, jaise pichhle 70 saal mein solve hua",1,joy,0,4.0
abhi cricket ko unki jarurat hai,0,neutral,5,5.0
congress and gandhi ka politics yeh tha ki angrez desh ko loot rahe unko nikal ke hum lootenge. so congress desh ko gulam bana rakha tha,0,anger,1,4.0
"well haan ross, pressing mera third nipple opens tha delivery entrance ko tha magical land of narnia.",1,neutral,5,4.0
"haan bilkul, budget allocation resolve hone wala hai, bass intezaar karo 10 saal aur dekho",1,neutral,5,0.0
adbhut nagina hindustani cricket team ka salaam hai aapko apki imandari aur lagan ke liye aap aur khele aur desh ka nam roshan kare!,0,anger,1,4.0
#sakshimaharaj kya fooka hai aapne aaj?bahut achi quality ka lagta hai tabhi aise statements de rahe hai! # #ganeshchaturthi hai aaj,1,joy,0,1.0
#livetweet #bollywood #ddlj #love #srk #srkfilmfest @iamsrk @kajolatun @ddlj legen-wait-for-it-dary tujhe dekha toh yeh jaana sanam! pic.twitter.com/jbxoeji68a,0,fear,3,3.0
woh hindu zyada khush ho rahe hain jinki bahan betiyon ko bhi ab triple talaq se securiy mil gai hai,0,joy,0,3.0
"first woman ips of india @thekiranbedi is praising the person (amit shah), jinki history se aap sabhi vaakif honge. gajab hai yar. #",1,anger,1,1.0
"ohh mujy nahi pata tha ""did"" k saath ""manage"" likhtay hain ",1,anger,1,0.0
"aaj gym mein achha workout hua, feeling energetic",0,joy,0,1.0
ye kameena sarkar kursi ki lalach mein politics karti hai in gadhon ko garibon ki koi parwa n hi agar koi meri help karna chahti hai to.,0,joy,0,0.0
yeh joh support kar rahe hai woh apne maa baap ko bech ke kha sakte hai toh yeh triple talaq hai kya,0,joy,0,0.0
if only there tha something mein tera head ko control tha things tum say.,1,neutral,5,5.0
#deshisdharam ye dekho.ye ab history padhane lag gaye.politics to ati nai aur chale batame ke history me kon kisne kya kiya.,0,fear,3,2.0
ye asmani kitab ne nhi hmlogo ne hi aisa chutiyapa pal kr rakha hai. desh ko bs kaise bata ja skta hai aaj ka politics hame yahi sikhata hai,0,neutral,5,2.0
aur aap ko kisi pol party join na karnay par bhee koi imanatdar mananay ko koi tyar nahi ? #,1,anger,1,4.0
tha british ho coming?,1,surprise,4,3.0
#cricket_news: - #lahore: dauray sri lanka kay liye chairman of #pcb ne 18 khilarion ka elaan kar dia: - junaid_f^r,0,fear,3,1.0
"rajat ji raja ram mohan roy ne sati pratha band karai thi, to triple talaq band hone me kya takleef hai",0,joy,0,3.0
"@narendramodi sir jab kisi ki apni beti, behan ke sath baba ka karnama aaega, jab dekhenge ki politics hoti hai ya decision. shame on think",0,sadness,2,2.0
"haan yaar, passion follow karo bills kisne bhare",1,joy,0,2.0
mere ek comment ne in jihadiyo ki itni sulga dee socho triple talaq ban hone se kaise sulag rahi hogi in ki?,0,neutral,5,5.0
"lucknow mein ""sandigdh"" aatankwadi ko maar dia aur kasab ko jail mein bitha ke khana khila rhe the ! #confused #",1,fear,3,2.0
"ansari uncle ne kahi inki wajah se to nahi kaha tha-""dar me jee rahe hain"". uper triple talaq ka jhatka lag gaya, ek umid bachi thi wo bhi.",0,neutral,5,2.0
ch sb. waqt se phle khuch bhe kehna munasib ni hota. politics mei khuch bhe final ni hota,0,disgust,7,2.0
abe chutiye yaha bache mar gaye aur tujhe har cheez me ghatiya politics karni h. khud ki bezzti hui to dusro ka naam lena shuru zabardasti,0,joy,0,7.0
"@mohsinhijazee pakistan mein 'na bus chalti hai oor na bus chalta hai"". #",1,fear,3,3.0
kehte hain agar kisi cheez ko dil se chaaho to puri kayanat usey tumse milane ki koshish mein lag jaati hai. #dada is back #ipl4 #srk #,0,joy,0,3.0
i'm listening ko tum snore. i'm wondering kaise i'll ever sleep without woh.,1,surprise,4,4.0
another throwback pic? nostalgia overload,1,neutral,5,1.0
"politics ke liye kuch log kuch bhi karne ke liye taiyar rahte hai. lasho pe bhi siasat. but then again, aap is wannabe congress with no base",0,neutral,5,0.0
"dubai: #icc odi ranking jari, junobi africa pehlay, australia dosray, #bharat teesray aur #pakistan chattay number per aa gaya. #cricket",0,fear,3,2.0
kitna nichhe gir gaye hain lok bachhon k marne par politics kar rahe hain chhi,0,joy,0,3.0
# => @akhtar978 log toot jaate hain ek ghar banaaney mein ! tum taras nahi khaatey bastiyaan jalaaney mein !,1,joy,0,0.0
@akshay_bhaii jab padhne ja raha hai to gn kyu bol raha hai? #,1,joy,0,0.0
sachin sir tumala baban chi adhvan te yet asal. jitki utkrashta tenchi marathi lekhane hote. tetkes utkrashtra tumche cricket aahe.,0,neutral,5,5.0
jeet gaye to jod tod ki politics ko karara jawab h aam admi party ka aur har jate to evm me setting kar rakhi thi,0,joy,0,5.0
aaj musalmano ne triple talaq par sc ke faisle ka virodh kiya jisme 100 gadiya jalayi aur 30 log mare gaye( agar aisa hota toh),0,neutral,5,5.0
eesi ka naam politics hai.in politician ki wajah se ram rahim jaise log crime karne ki himat kar pate hai.,0,anger,1,4.0
abe maana bey zindagi tu cricket hai aur mai us ka stuart binny par fulltoss ball bhi bat ko nahi lage aise bhi zulm mat kar,0,neutral,5,4.0
fatwa lag jata agar gareeb ladki hoti ho. choice ki to baat mat kr. triple talaq aur halala kisi bhi ladki ki choice nhi ho sakti.,0,joy,0,5.0
"aajkal triple talaq ke kisse nazar nahi aa rhe,arey haa ab koi chunaav thodi @incindia @ranaayyub",0,anger,1,1.0
"ye baat, dahi haandi, jalikattu ye sb nautanki baaz h triple talaq b khtm hoga, ram mandir bhi bnega.mecca h to ayodhya bhi hogi",0,neutral,5,4.0
"@pmoindia kya politics hai modiji aap to bade kamaal ho , bahut bade strategist ho , media mei ro ke pure din chhaye rahoge",0,joy,0,5.0
jab pakistan ka aur cricket ka naam ata hai tho dil aur dimaag mein ek naam chal raha hota ha @mir_sana05,0,joy,0,0.0
