text,label,emotion,emotion_encoded,emotion_shift
शायद कुछ मदद के लिए फोन के सच्चे मालिक से पूछ - ताछ करें ।,1,neutral,5,0.0
शायद सबसे बढ़िया सुपर प्रतिनिधि कि उसका पैसा खरीद सकता है...,1,neutral,5,0.0
वह कितना आकर्षक लगता है!,1,neutral,5,0.0
"जी हाँ, क्योंकि बरश प्रशासन ने मध्य पूर्व में सम्बन्धों के लिए अद्‌भुत काम किए ।",1,neutral,5,0.0
मुझे अच्छा लगा जैसे एक शांत बच्चा चोर... ... वह पहियों के साथ आता है और शायद ऊब से सो रहा हो.,1,neutral,5,0.0
साल का कुल बिन्दु?,1,neutral,5,0.0
अच्छा तर्क!,1,neutral,5,0.0
"3रा पार्टी, प्रतिबंध, हम कुछ भी के साथ खेलने की अनुमति नहीं है जो हमें खेल के लिए सहायक जानकारी या सुधार रणनीति देता है, क्योंकि यह 5 साल के लिए अन्याय कर देगा जो वास्तव में अपने उंगलियों को स्क्रीन में स्क्रीन में उपयोग करने का आनन्द लेता है",1,neutral,5,0.0
"लेकिन अगर मैं यह करता हूँ और कुछ और लोग भी ऐसा करते हैं, तो यह सही नहीं होगा?",1,neutral,5,0.0
वे इतना अजीब क्यों बोलते हैं?,1,neutral,5,0.0
लेकिन क्या ऐसा नहीं है कि कुछ चेहरे होगा?,1,neutral,5,0.0
शोक है कि आप कनाडा में सुबह जादू कैसे है.,1,neutral,5,0.0
वे अंधे हैं आप उन्हें बाहर मार्गदर्शन करने की जरूरत है,1,neutral,5,0.0
आप उबुन्टू के डेस्कटॉप वातावरण का मतलब है?,1,neutral,5,0.0
अब हम ध्वज uuuuuuhhhhhhhuhuh को बदलने के लिए है,1,neutral,5,0.0
"आप कहते हैं कि, लेकिन मैं मदद नहीं कर सकता लेकिन तस्वीर से सभी कि बियर स्पष्ट रूप से बी से दूर है.",1,neutral,5,0.0
"हाँ, यह स्पष्ट रूप से fucutio की गलती भी है, वे अपने देश की रक्षा करने की कोशिश करके सभी के बाद उसे भड़का दिया.",1,neutral,5,0.0
यहोवा ने आदम और हव्वा को मिस्र से आज़ाद किया,1,neutral,5,0.0
यही कारण है कि आप ताश की डेक ले और इसे एक स्पष्ट हथियार के रूप में इस्तेमाल करें.,1,neutral,5,0.0
"ओह हाँ, क्योंकि लालितिट एक ऐसी जगह है जहाँ आप सबसे अच्छी तरह से चारों ओर, इंटरनेट पर निष्पक्ष राय प्राप्त कर सकते हैं बिना किसी भी विचार",1,neutral,5,0.0
मेरे जीपी को उन लानत रूस द्वारा संपादित किया गया था.,1,neutral,5,0.0
उन टैबों को जानबूझकर रखा गया था,1,neutral,5,0.0
"यार, ""अपने आप को इनकार"" इस तरह एक पकड़!",1,neutral,5,0.0
"नहीं, क्योंकि यह छोटी लड़कियों के लिए ठीक नहीं है पुरुषत्व बनाने की कोशिश करने के लिए, लेकिन यह पूरी तरह से ठीक है सभी लड़कों को स्त्रैण करना और उनके पुरुषत्व का पता लगाना कभी भी ठीक नहीं है.",1,neutral,5,0.0
"अपने मॉनीटर में एक बहुत अच्छा गायू के साथ, शायद",1,neutral,5,0.0
"नहीं आदमी यह इतना स्वार्थी और बहुत है, मुझे यकीन है कि हर शराब से संबंधित कंपनी भी काम पर पीने की अनुमति देती है.",1,neutral,5,0.0
"हाँ, हम अभी भी इंग्लैंड के स्तर पर मुकाबला करने में सक्षम होने तक जाने के लिए एक लंबा तरीका है",1,neutral,5,0.0
आप इसे दो बार शांति के सपने के साथ,1,neutral,5,0.0
"तो, मुझे बताओ, तुम कैसे एक युक्ति है कि 100% ईको - अनुकूल है कि रेड्डिट पर पोस्ट कर सकते हैं क्योंकि मुझे यकीन है कि व्यापार दुनिया साझा करने के लिए प्यार करता है?",1,neutral,5,0.0
वहाँ मेरा स्वोके ग्रह मोत सिद्धांत चला जाता है,1,neutral,5,0.0
आप इस बारे में बहुत दुखी नहीं हैं उम्मीद है कि आपके शैतानर्स एक मुकुट नहीं है.,1,neutral,5,0.0
एएम लेडोन 6950x के लिए स्तर निर्धारित किया जाना चाहिए था.,1,neutral,5,0.0
एक डे्का स्वतंत्रता इकाई!,1,neutral,5,0.0
यू. एस.,1,neutral,5,0.0
कृपया मुझे एक लिंक नहीं है!,1,neutral,5,0.0
"नहीं, मुझे लगता है कि वास्तव में आप ही एकमात्र व्यक्ति हैं!",1,neutral,5,0.0
दुनिया के सभी मुख्य निगमों के नक्शे पर ध्यान दीजिए,1,neutral,5,0.0
जेना मेर!,1,neutral,5,0.0
"नहीं, आप स्पष्ट रूप से एक दुखी है और यह एक अर्थपूर्ण, एक अर्थपूर्ण और सफल जीवन जीने के लिए असंभव है बिना किसी और के आप को ""पूरा"" के बिना.",1,neutral,5,0.0
क्वीनी सोइया यू. डी. डी.,1,neutral,5,0.0
लेकिन यह सब दान करने के लिए चला जाता है.,1,neutral,5,0.0
उन्होंने कहा कि टोटेम गर्मियों पसंद नहीं है ... बेहतर है?,1,neutral,5,0.0
यदि आप विशेष रूप से यह सुनिश्चित करने के लिए सुनिश्चित हैं कि किसी को मूल्य के बारे में पूछ जाएगा,1,neutral,5,0.0
"उन्होंने कहा कि बीच के शहर में रहता है, वह शायद दवाओं पर है",1,neutral,5,0.0
कम से कम आप देख सकता है... ... ग्रॉस्क।,1,neutral,5,0.0
"हाँ, सब अच्छा कच्चे स्मिट्स का उपयोग करने के लिए करते हैं",1,neutral,5,0.0
नहीं देखा * कि आ रहा है *.,1,neutral,5,0.0
वास्तव में रुको?,1,neutral,5,0.0
वह अब तक अपने खेल के बारे में कैसा महसूस करता है देखने के लिए...,1,neutral,5,0.0
उन्हें कितनी अच्छी तरह आकर्षित करता है क्योंकि हर राज्य - मैं देख सकता हूँ कि क्यों कोई भी कभी उनके टोपी नहीं करेगा!,1,neutral,5,0.0
युद्ध - ग्रस्त!,1,neutral,5,0.0
"आपने सोचा कि ""आप"" सिर्फ अपना प्रयोक्ता नाम था?",1,neutral,5,0.0
खैर वे एक साल के लिए दूध की जरूरत है इससे पहले कि वे मूँगफली के मक्खन और कोल सहायता में स्विच करें तो फिर वहाँ नहीं बढ़ रहे हैं,1,neutral,5,0.0
मुझे लगता है कि वह मजाक कर रहा है लेकिन भूल गया,1,neutral,5,0.0
यूक्रेन में सर्दियों कभी नहीं था.,1,neutral,5,0.0
"ओह, आप इस विषय के बारे में एक तर्कसंगत चर्चा में बहुत दिलचस्पी रखते हैं, मैं आप के साथ इस विषय पर बात करने के लिए बहुत उत्सुक हूँ ।",1,neutral,5,0.0
"हर कोई शांत करने के लिए सबसे अच्छा तरीका जानता है, वैध दलील का उपयोग करने के लिए giffify किनारे का उपयोग करना",1,neutral,5,0.0
तो फिर आप इसे एक पैक क्यों कहा?,1,neutral,5,0.0
मुझे लगता है कि वे अपने चूहे ज्यादा बार उठा.,1,neutral,5,0.0
"मुझे लगता है कि हम सिर्फ एक बेतरतीब टीम भेजें... ... हम दुनिया भर के लिए जीत जाएगा कि सभी शांत चुनौतीहीन खिलाड़ियों, कि कैसे है",1,neutral,5,0.0
"लगता है कि मैं बेहतर होगा अपने जूते से अपने आप को उठा लिया तो, बुद्धिमान शब्दों के लिए धन्यवाद!",1,neutral,5,0.0
"यह एक जादुई पूर्व मशीन है, कि कैसे है.",1,neutral,5,0.0
"जब आप व्यवहार - कुशल समय में बाधा डालते हैं, तो बहुत भारी मौत हो जाती है!",1,neutral,5,0.0
"जाहिर है, अगर महिलाओं के भाग में 12o लड़कों की दुकान...",1,neutral,5,0.0
"वे अंग्रेजी वे नहीं बोल सकते थे, और यह क्या बात है, एकमीरी?",1,neutral,5,0.0
"खैर मुझे यकीन है, व्यापार_no_ अधिक.",1,neutral,5,0.0
"तो giio जवाब है, आप क्या कह रहे हैं?",1,neutral,5,0.0
"जी हाँ, क्योंकि एक पौधा पीना पापमय है ।",1,neutral,5,0.0
आपको लगता है कि अगर आप बड़े थे तो आप उसे नीचे लेने की कोशिश कर सकते हैं?,1,neutral,5,0.0
हो सकता है कि बहनों को प्रलोभन से बचने के लिए ज़्यादा मर्यादा में रहने की ज़रूरत पड़े ।,1,neutral,5,0.0
"बढ़िया विचार है, चलो स्थिति को बढ़ाते हैं!",1,neutral,5,0.0
बीटा,1,neutral,5,0.0
"हाँ, क्योंकि मैं सीधे खड़े होने के लिए संघर्ष कर रहा हूँ, टाइटैनिक रूप से और चिंता और चिंता क्यों इस पागल बैग साँस नहीं ले रहे हैं 'नहीं कर रहे हैं' रहे हैं.",1,neutral,5,0.0
अगर वे वास्तव में दोषी हैं तो स्ट्रीमिंग प्रक्रिया और पहले से ही इन्हें मारना.,1,neutral,5,0.0
कम - से - कम विदेशी कर्मचारियों ने सारे मैरिकार्ड्स काम भरे!,1,neutral,5,0.0
अब इसे एक स्टार हत्यारा ग्रह माना जाता है,1,neutral,5,0.0
"यार rangers यह स्पष्ट रूप से माइक merthy है, आदमी rodended स्थिति में मूर्ख डाल दिया है.",1,neutral,5,0.0
क्योंकि बाक़ी के लोग यह इतना तर्कसंगत समझते हैं,1,neutral,5,0.0
मैं संयोग में विश्वास नहीं है...,1,neutral,5,0.0
"मुझे देखने की एक निरन्तर धारा के साथ प्रदान करने के लिए धन्यवाद, नयी वास्तविकताओं को दबाने के लिए.",1,neutral,5,0.0
संसद में प्रश्न समय।,1,neutral,5,0.0
"ओह, मेरे बुरे, मुझे नहीं पता था कि frs, brz और ft86 सभी एक ही कार नहीं थे.",1,neutral,5,0.0
"हाँ, क्योंकि ड्रग्स = जादू कार्ड की तस्वीरें",1,neutral,5,0.0
वे सफ़ेद हैं तो यह एक घृणा अपराध नहीं हो सकता!,1,neutral,5,0.0
"हाँ, कि उसे दिखाना होगा!",1,neutral,5,0.0
नहीं आदमी हम पहले से ही एक मुसलमान राष्ट्रपति है,1,neutral,5,0.0
हाँ यह उनकी गलती को सही तरह से लागू कर रहा है.,1,neutral,5,0.0
हल: एक अस्थायी साधन में काम कीजिए ।,1,neutral,5,0.0
कि एक सदमाक है...,1,neutral,5,0.0
तो यह सही नहीं है.,1,neutral,5,0.0
उसका धर्म सार्वजनिक रूप से कोई स्थान नहीं है.,1,neutral,5,0.0
मैं भी अगर किसी ने याद किया है कि संदर्भ याद है,1,neutral,5,0.0
"क्या यह एक ""विधम"" है या एक पेय है?",1,neutral,5,0.0
एनाआआडा और लिस्बन,1,neutral,5,0.0
"जब तक यह एक छेद होंठ नहीं है, क्योंकि वास्तव में उन्हें ""उत्तम"" दिखाई देता है",1,neutral,5,0.0
"लेकिन वह निश्चित रूप से डी चाहते हैं, हर लड़की जो मेरे रास्ते देखता है!",1,neutral,5,0.0
"जी हाँ, मैं सोच रहा था कि क्या सबसे ज़्यादा प्रशंसा और लाक्षणिक राजनीतिक पुस्तकों * * की प्रशंसा की जाएगी ।",1,neutral,5,0.0
"हाँ, लेकिन यह प्रक्रिया के लिए एक नौ महीने का इंतजार था!",1,neutral,5,0.0
"अगर आप उन्हें 6 महीने बाद अपने बिस्तर में सोने देते हैं तो आप शायद उन्हें वहीं रहने दें, जब तक कि वे उच्च स्कूल की पढ़ाई खत्म न कर लें!",1,neutral,5,0.0
"खैर, उन्होंने परिवार को एक फल टोकरी दे दी...",1,neutral,5,0.0
भारत में हमारी सहायता पैसा के कारण एक मजबूत स्थान कार्यक्रम है कि हम अपने लिए एक नहीं खरीद सकते हैं और हर कोई भोजन बैंक #vacue पर है,1,neutral,5,0.0
"वास्तव में, हम ius 12 तक इंतजार करना चाहिए.",1,neutral,5,0.0
आप पर अच्छी तरह से मजाक कर रहे हैं. वह jah करने के लिए जा रहे हैं और आप नहीं कर रहे हैं,1,neutral,5,0.0
"वाह, वहाँ पर जगह दोस्त.",1,neutral,5,0.0
"हाँ मैं अपनी बात देखते हैं, वे हमें खुश ग्राहकों की तरह इलाज कर रहे हैं और उन विचारों को सुनने के लिए तैयार हैं.",1,neutral,5,0.0
कोल्ड्स को नीचे ले लिया गया है उसके बाद ^^^^2,1,neutral,5,0.0
तुम लोगों को मजबूर करते हो कि वे एक गाड़ी या कम - से - कम आम जगहों से जुड़े रहें ।,1,neutral,5,0.0
हालांकि कम से कम योजना योजना प्रोग्रामों के लिए पैसा नहीं मिल रहा है गरीब लोगों के लिए पैसे और hiv परीक्षण.,1,neutral,5,0.0
उसके चुने हुए विश्‍वविद्यालय के निजी विश्‍वविद्यालय के लिए अच्छी तरह से किया जा रहा है... वास्तव में यही बात है.,1,neutral,5,0.0
आप भी जानते हैं कि वे ब्लैक बाजार भाई के लिए जाने के लिए कितना है?,1,neutral,5,0.0
वहाँ कोई रास्ता नहीं है कि उपयोक्ता संस्थापित कुछ भी बुरी तरह से जाना जा सकता है.,1,neutral,5,0.0
आप mgvv विक्रेताों के लिए निशान नहीं था!,1,neutral,5,0.0
लेकिन तब क्या जब आपको पानी का तापमान पता होना चाहिए?,1,neutral,5,0.0
"जी हाँ, यह किसी भी व्यवस्था के सबसे महत्त्वपूर्ण रहस्य है",1,neutral,5,0.0
ऐसा क्यों है कि जाति - भेदी इस गंदगी में मारा जाता है?,1,neutral,5,0.0
"आप एक अच्छा बिंदु बनाने के लिए, बाजार पूरी तरह से एक बेकार उपकरण है.",1,neutral,5,0.0
हाँ तो यह बेहतर है अगर योद्धा जीत तो हम सैनिकों को नहीं मिलता है,1,neutral,5,0.0
ओमजी सोनी एलएल,1,neutral,5,0.0
"यार, आपके व्याकरण त्रुटि ने टिप्पणी को पूरी तरह से बिना पढ़ा हुआ बनाया!",1,neutral,5,0.0
"आप जानते हैं, यदि उनके पास आपूर्ति और माँग के विषय हैं, तो उन्हें एक आमंत्रण प्रणाली या कुछ और करने के बारे में सोचना चाहिए",1,neutral,5,0.0
"मुझे पता है मैं इंटरनेट पर ऐसा सामान नहीं कहना चाहिए, जो जानता है कि परिणाम क्या होगा।",1,neutral,5,0.0
इसे 300 कहा जाता है,1,neutral,5,0.0
बस सभी मकानों में तोड़!,1,neutral,5,0.0
एक ठोस कारण की तरह लग रहा है.,1,neutral,5,0.0
क्योंकि केवल गणराज्यीय हो सकते हैं.,1,neutral,5,0.0
"1 या 2, हाँ.",1,neutral,5,0.0
एम आपको आधिकारिक रहस्य कार्य को तोड़ने के बारे में देखना चाहता है,1,neutral,5,0.0
वे समय पर बाहर कर रहे हैं पर निर्भर करता है.,1,neutral,5,0.0
cargers cononson?,1,neutral,5,0.0
"मैं , वे और अधिक कुशल कर रहे हैं की सिफारिश करते हैं.",1,neutral,5,0.0
मैं रॉब इतना परेशान होना बंद कर देगा,1,neutral,5,0.0
"देखो, इन नेताओं को हमारी नौकरी वापस मिल गई.",1,neutral,5,0.0
"आप कैसे कमबख्त, आप यह एक घृणित बात पता नहीं है और कि बच्चे को उसके लिए खुद के लिए खेलने की जरूरत है?",1,neutral,5,0.0
सिर्फ एक बार फिर कल्पना भी नहीं की जाएगी ।,1,neutral,5,0.0
अरे दोस्तों तुमने सुना है भाग्य एक कंधे चोट है?,1,neutral,5,0.0
उन्हें अभी क्या जरूरत है... ... एक राजधानी प्राप्त कर कटौती है.,1,neutral,5,0.0
ऐसी सम्मानजनक पेशा.,1,neutral,5,0.0
तुम समाजवादी के लिए वोट जाओ.,1,neutral,5,0.0
"आप इसे पहले सुना था, 3 में स्पिटर्स!",1,neutral,5,0.0
"नहीं आई7, तो यह भयानक होना चाहिए",1,neutral,5,0.0
वह स्पष्ट रूप से यात्रा ii के बूटों वाला था.,1,neutral,5,0.0
"जो मानो उजली हो, वह मानो पाप है।",1,neutral,5,0.0
हा.,1,neutral,5,0.0
कृपया,1,neutral,5,0.0
बस बिल्ली भोजन खा सकते हैं.,1,neutral,5,0.0
ऐसा नहीं है कि कैसे डेमो अपने वोटर का एक बहुत बड़ा टुकड़ा है?,1,neutral,5,0.0
"हाँ, सब जानते हैं कि ""विज्ञान"" सिर्फ अमेरिकी प्रचार है।",1,neutral,5,0.0
इतनी जल्दी नहीं की ... ..,1,neutral,5,0.0
हाँ मेरे पास कोई दोस्त नहीं है जो pc पर खेल,1,neutral,5,0.0
आप इस भूल जाते हैं,1,neutral,5,0.0
"कभी नहीं, आप उन सभी को खुला हथियारों के साथ स्वीकार न करने के लिए शत्रुतापूर्ण कर रहे हैं.",1,neutral,5,0.0
यह खत्म हो गया है सब कुछ खत्म करने के लिए एक segesens सहायता,1,neutral,5,0.0
क्योंकि लोग मुझे पसंद नहीं करना चाहिए,1,neutral,5,0.0
"नहीं, ये स्पष्ट रूप से फूरवादी हैं",1,neutral,5,0.0
"क्लासिक संगीत गंभीर, कठोर, और लापरवाह होना चाहिए!",1,neutral,5,0.0
मैं अमेरिका में कहा जाता है कि वे अभी भी उसके बारे में बात कर रहे हैं अगर वह secutioy बलात्कार * है प्रेमिका है।,1,neutral,5,0.0
